latitude,longitude,elevation,utc_offset_seconds,timezone,timezone_abbreviation,,,,,,,,,,,,,,,,,
40.4375,-3.6875,651,3600,Europe/Madrid,GMT+1,,,,,,,,,,,,,,,,,
,,,,,,,,,,,,,,,,,,,,,,
time,weather_code (wmo code),temperature_2m_max (°C),apparent_temperature_max (°C),temperature_2m_min (°C),apparent_temperature_min (°C),wind_speed_10m_max (km/h),wind_direction_10m_dominant (°),wind_gusts_10m_max (km/h),shortwave_radiation_sum (MJ/m²),et0_fao_evapotranspiration (mm),sunrise (iso8601),sunset (iso8601),daylight_duration (s),sunshine_duration (s),uv_index_max (),uv_index_clear_sky_max (),rain_sum (mm),showers_sum (mm),snowfall_sum (cm),precipitation_sum (mm),precipitation_hours (h),precipitation_probability_max (%)
01/01/22,3,15.2,12.4,8,4.4,9.4,37,9,8.54,1.64,2022-01-01T08:37,2022-01-01T17:58,33641.68,29946.07,2.6,2.7,0,0,0,0,0,NaN
02/01/22,3,14.2,11.7,8.5,5.6,6.1,20,4.7,6.85,1.2,2022-01-02T08:38,2022-01-02T17:59,33684.92,29861.16,2.3,2.7,0,0,0,0,0,NaN
03/01/22,3,13.6,11.3,7.7,5.5,10.9,219,10.8,7.66,1.14,2022-01-03T08:38,2022-01-03T18:00,33731.88,30046.83,2.6,2.7,0,0,0,0,0,NaN
04/01/22,53,12.1,7.7,6.7,0.7,33.2,255,50.8,6.54,1.23,2022-01-04T08:38,2022-01-04T18:01,33783.1,24564.47,2.65,2.7,1,0.1,0,1.1,3,NaN
05/01/22,53,8.8,4.1,5,-1.5,31.4,289,40,7.15,1.63,2022-01-05T08:38,2022-01-05T18:02,33838.55,23313.61,2.6,2.6,1.4,0,0,1.4,4,NaN
06/01/22,3,8.6,4.7,2.7,-0.3,10.3,326,11.2,9.75,1.3,2022-01-06T08:37,2022-01-06T18:03,33898.11,30232.76,2.75,2.75,0,0,0,0,0,NaN
07/01/22,3,10.6,7.3,2.8,-0.5,9.5,10,16.6,9.41,1.35,2022-01-07T08:37,2022-01-07T18:03,33961.62,30303.58,2.75,2.75,0,0,0,0,0,NaN
08/01/22,3,8,3.6,2.5,-0.5,19.7,248,30.6,7.96,1.36,2022-01-08T08:37,2022-01-08T18:04,34028.94,30378.54,2.25,2.7,0,0,0,0,0,NaN
09/01/22,3,13.9,7.9,3.6,-2.3,34.7,274,48.6,7.25,2,2022-01-09T08:37,2022-01-09T18:05,34099.93,27829.07,2.7,2.7,0,0,0,0,0,NaN
10/01/22,3,14.2,11.7,8.3,5.6,24.2,308,38.5,9.11,1.5,2022-01-10T08:37,2022-01-10T18:06,34174.46,30540.23,2.75,2.75,0,0,0,0,0,NaN
11/01/22,2,13.4,11.4,6.9,4.1,10.1,355,8.3,9.5,1.41,2022-01-11T08:37,2022-01-11T18:08,34252.37,30626.62,2.8,2.8,0,0,0,0,0,NaN
12/01/22,0,11.7,7,5.3,1.1,21.6,49,26.3,10.07,1.97,2022-01-12T08:36,2022-01-12T18:09,34333.54,30716.5,2.8,2.8,0,0,0,0,0,NaN
13/01/22,3,9.4,5.3,3.5,-0.4,12.6,63,22.3,9.89,1.74,2022-01-13T08:36,2022-01-13T18:10,34417.8,30809.68,2.8,2.8,0,0,0,0,0,NaN
14/01/22,0,8.3,4.3,2.4,-1,10.4,70,14.4,10.21,1.56,2022-01-14T08:36,2022-01-14T18:11,34505.04,30906.01,2.8,2.8,0,0,0,0,0,NaN
15/01/22,0,7.5,4.8,2,-1.6,9.8,66,12.6,10.11,1.36,2022-01-15T08:35,2022-01-15T18:12,34595.11,31005.33,2.85,2.85,0,0,0,0,0,NaN
16/01/22,2,8.7,5.5,1.8,-1.6,6.4,45,5.4,10.34,1.29,2022-01-16T08:35,2022-01-16T18:13,34687.88,31107.48,2.95,2.95,0,0,0,0,0,NaN
17/01/22,3,9.8,6.7,2.5,-1.3,8.7,48,7.6,10.26,1.57,2022-01-17T08:34,2022-01-17T18:14,34783.2,31212.3,2.9,2.95,0,0,0,0,0,NaN
18/01/22,3,10.5,6.8,2.9,-1.1,8.2,42,5.8,9.8,1.55,2022-01-18T08:34,2022-01-18T18:15,34880.95,31319.64,2.9,3,0,0,0,0,0,NaN
19/01/22,3,11.3,7.7,3.5,-0.5,8.8,36,8.3,10.8,1.82,2022-01-19T08:33,2022-01-19T18:16,34980.98,31429.34,3.05,3.05,0,0,0,0,0,NaN
20/01/22,3,11.2,8.3,3.6,-0.5,12.8,39,26.3,10.62,1.84,2022-01-20T08:33,2022-01-20T18:18,35083.18,31541.24,3.05,3.05,0,0,0,0,0,NaN
21/01/22,0,8.9,3.8,2.5,-1.8,18.9,47,35.6,10.79,1.85,2022-01-21T08:32,2022-01-21T18:19,35187.42,31655.21,3.05,3.05,0,0,0,0,0,NaN
22/01/22,0,8.9,5.7,1.7,-2.8,19,47,32,10.84,1.81,2022-01-22T08:32,2022-01-22T18:20,35293.55,31771.09,3.1,3.1,0,0,0,0,0,NaN
23/01/22,0,10.1,6.6,2.7,-1.2,11.7,58,15.8,10.85,1.62,2022-01-23T08:31,2022-01-23T18:21,35401.65,31889.13,3.1,3.1,0,0,0,0,0,NaN
24/01/22,3,10,6.6,3,-0.5,12.5,65,13.7,10.83,1.61,2022-01-24T08:30,2022-01-24T18:22,35512.87,32010.51,3.2,3.2,0,0,0,0,0,NaN
25/01/22,3,10.6,6.8,3.4,-1.1,15.1,63,24.8,7.47,1.52,2022-01-25T08:30,2022-01-25T18:23,35627.26,29808.66,3.2,3.2,0,0,0,0,0,NaN
26/01/22,0,11,7.2,2.9,-0.8,14.3,60,19.1,10.94,1.77,2022-01-26T08:29,2022-01-26T18:25,35744.65,32190.56,3.2,3.2,0,0,0,0,0,NaN
27/01/22,0,12.6,8.6,3.9,-0.4,14.3,50,28.1,11.58,2.3,2022-01-27T08:28,2022-01-27T18:26,35864.84,32274.3,3.25,3.25,0,0,0,0,0,NaN
28/01/22,0,13.4,9.1,3.3,-1.7,14.1,46,28.8,12.19,2.67,2022-01-28T08:27,2022-01-28T18:27,35987.66,32353.45,3.25,3.25,0,0,0,0,0,NaN
29/01/22,0,14.6,9.9,4.1,-0.8,13,50,22.7,12.31,2.88,2022-01-29T08:26,2022-01-29T18:28,36112.93,32432.44,3.4,3.4,0,0,0,0,0,NaN
30/01/22,0,14.5,11,5.1,0.4,10.2,35,8.6,12.36,2.34,2022-01-30T08:25,2022-01-30T18:29,36240.46,32473.58,3.4,3.4,0,0,0,0,0,NaN
31/01/22,0,15.8,11.7,5.3,1.4,13.9,335,21.6,12.37,2.35,2022-01-31T08:24,2022-01-31T18:31,36370.09,32448,3.5,3.5,0,0,0,0,0,NaN
01/02/22,0,17,13,5.4,1.9,15,10,41,11.97,2.28,2022-02-01T08:23,2022-02-01T18:32,36501.65,32519.78,3.6,3.6,0,0,0,0,0,NaN
02/02/22,2,17.2,14.2,6.8,3.9,14.1,32,22,12.83,2.15,2022-02-02T08:23,2022-02-02T18:33,36634.97,32614.33,3.65,3.65,0,0,0,0,0,NaN
03/02/22,3,15.1,11.3,7.6,4.9,14.6,238,18.7,10.18,1.89,2022-02-03T08:21,2022-02-03T18:34,36769.88,32496.7,3.1,3.65,0,0,0,0,0,NaN
04/02/22,3,13.7,9.9,7.5,5.4,11.3,232,11.5,9.34,1.68,2022-02-04T08:20,2022-02-04T18:36,36906.22,32442.25,3,3.65,0,0,0,0,0,NaN
05/02/22,3,13.5,8.2,7.8,3.3,22.7,42,30.6,12.03,2.72,2022-02-05T08:19,2022-02-05T18:37,37043.84,32720.42,3.7,3.7,0,0,0,0,0,NaN
06/02/22,3,12.7,9.5,4.7,0.2,16.9,35,28.4,13.08,2.35,2022-02-06T08:18,2022-02-06T18:38,37182.58,33003.32,3.75,3.75,0,0,0,0,0,NaN
07/02/22,0,15,12,5.4,1.4,11.6,40,16.6,13.24,2.44,2022-02-07T08:17,2022-02-07T18:39,37322.29,33029.79,3.8,3.8,0,0,0,0,0,NaN
08/02/22,0,15.9,12.5,5.8,2.1,22.7,63,39.2,13.3,2.65,2022-02-08T08:16,2022-02-08T18:41,37462.83,33288.36,3.85,3.85,0,0,0,0,0,NaN
09/02/22,0,14.2,11.5,6.6,3.6,9.7,62,5.8,13.56,2.19,2022-02-09T08:15,2022-02-09T18:42,37604.04,33405.83,3.9,3.9,0,0,0,0,0,NaN
10/02/22,3,15.2,11.9,6.5,3.3,9.2,300,12.6,13.04,2.22,2022-02-10T08:14,2022-02-10T18:43,37745.79,33370.58,3.85,3.95,0,0,0,0,0,NaN
11/02/22,3,16.3,13.1,7.9,5,8.3,344,15.8,13.03,2.23,2022-02-11T08:13,2022-02-11T18:44,37887.93,33664.25,3.7,3.95,0,0,0,0,0,NaN
12/02/22,3,14.1,10.7,7.7,4,12.2,138,18.4,11.44,2.28,2022-02-12T08:11,2022-02-12T18:45,38030.52,33417.68,3.7,3.95,0,0,0,0,0,NaN
13/02/22,53,12.3,7.3,7.9,2.6,32.2,230,45.7,9.34,1.83,2022-02-13T08:10,2022-02-13T18:47,38174.89,33015.09,3.45,4,0,1.2,0,1.2,8,NaN
14/02/22,51,10.6,4.4,6.2,0.6,30.6,288,39.6,14.41,2.77,2022-02-14T08:09,2022-02-14T18:48,38321.15,34797.96,4.05,4.05,0.1,0.2,0,0.3,3,NaN
15/02/22,3,12.5,6.9,4.3,0.7,19.3,270,37.1,13.44,2.55,2022-02-15T08:08,2022-02-15T18:49,38469.15,34530.07,3.85,4.05,0,0,0,0,0,NaN
16/02/22,3,14.3,10.1,5.8,2.4,23.5,297,20.5,12.93,2.4,2022-02-16T08:06,2022-02-16T18:50,38618.73,34709.02,4.25,4.3,0,0,0,0,0,NaN
17/02/22,3,16.1,14.1,6.7,4.6,6.9,357,11.2,14.64,2.13,2022-02-17T08:05,2022-02-17T18:51,38769.76,35378.16,4.4,4.4,0,0,0,0,0,NaN
18/02/22,3,17.4,14.7,8.5,6.6,15.1,245,14.8,14.58,2.45,2022-02-18T08:04,2022-02-18T18:53,38922.09,35607.99,4.35,4.35,0,0,0,0,0,NaN
19/02/22,51,13,10.8,6.1,0.2,30.6,52,39.2,4.21,2,2022-02-19T08:02,2022-02-19T18:54,39075.56,14477.84,2.4,4.15,0.2,0,0,0.2,2,NaN
20/02/22,3,13.3,10.3,3.8,0.4,11.2,27,10.1,15.51,2.52,2022-02-20T08:01,2022-02-20T18:55,39230.05,35715.85,4.4,4.4,0,0,0,0,0,NaN
21/02/22,3,16.3,13,6.4,3.3,13.8,26,22,15.77,2.84,2022-02-21T08:00,2022-02-21T18:56,39385.41,36141.37,4.45,4.5,0,0,0,0,0,NaN
22/02/22,3,17.7,13.7,6.2,1.3,10.7,39,12.6,16.48,3.25,2022-02-22T07:58,2022-02-22T18:57,39541.51,36304.35,4.6,4.6,0,0,0,0,0,NaN
23/02/22,3,16.1,12.6,6.7,1.8,14.6,52,20.5,12.84,2.95,2022-02-23T07:57,2022-02-23T18:58,39698.21,35778.95,4.05,4.6,0,0,0,0,0,NaN
24/02/22,3,16,12.4,7.4,3.7,21.6,53,39.6,12.68,2.84,2022-02-24T07:55,2022-02-24T19:00,39855.4,33737.89,4.05,4.7,0,0,0,0,0,NaN
25/02/22,51,11.5,7.5,8.8,4.8,25.9,60,40.3,2.8,1.55,2022-02-25T07:54,2022-02-25T19:01,40012.93,5441.64,1.3,4.45,0.4,0,0,0.4,2,NaN
26/02/22,51,10.2,7,7.9,4,18.2,80,25.6,1.5,1.14,2022-02-26T07:52,2022-02-26T19:02,40170.67,1079.66,0.65,4.5,0.1,0,0,0.1,1,NaN
27/02/22,51,11.4,9.2,7.1,4.4,12.6,64,13,7.01,1.24,2022-02-27T07:51,2022-02-27T19:03,40328.52,21567.08,2.9,4.6,0.7,0,0,0.7,3,NaN
28/02/22,0,15.6,13.3,6.2,3.1,10.2,10,18.4,16.98,2.73,2022-02-28T07:49,2022-02-28T19:04,40486.32,37285.43,4.85,4.85,0,0,0,0,0,NaN
01/03/22,3,16.8,13,6.8,4.2,19.1,245,25.9,16.74,3.12,2022-03-01T07:48,2022-03-01T19:05,40643.99,37448.25,4.9,5,0,0,0,0,0,NaN
02/03/22,3,16.3,12.2,7.5,4.2,23.2,273,32,15.73,3.44,2022-03-02T07:46,2022-03-02T19:06,40801.38,37610.54,4.9,4.95,0,0,0,0,0,NaN
03/03/22,80,10.2,6.5,7.5,2.1,29.3,288,36,2.36,0.84,2022-03-03T07:45,2022-03-03T19:08,40958.38,7150.87,1.1,4.65,7,0.1,0,7.1,10,NaN
04/03/22,80,12.4,8.4,5.6,2,21.7,17,39.2,14.34,2.72,2022-03-04T07:43,2022-03-04T19:09,41115.05,36795.8,4.85,4.95,1.7,0.1,0,1.8,3,NaN
05/03/22,3,11,7.9,4.3,1.4,18.6,69,29.2,17,2.65,2022-03-05T07:42,2022-03-05T19:10,41272.62,38094.8,5,5.1,0,0,0,0,0,NaN
06/03/22,53,11.5,8.4,3.9,-1.8,25.6,59,36.7,18.09,3.1,2022-03-06T07:40,2022-03-06T19:11,41431.23,38257.24,5.15,5.15,0.7,0.1,0,0.8,2,NaN
07/03/22,85,10.2,7.3,4.9,0.8,18,70,23.4,4.99,0.99,2022-03-07T07:39,2022-03-07T19:12,41590.79,20031.95,3.05,5.15,4.9,1.2,0.07,6.1,16,NaN
08/03/22,51,11.2,7.8,4.8,-0.2,21.4,219,38.5,14.54,2.19,2022-03-08T07:37,2022-03-08T19:13,41751.15,33008.47,4.7,5.15,0,0.4,0,0.4,3,NaN
09/03/22,3,13.6,10.8,5,2.3,12.9,226,19.8,12.96,2.09,2022-03-09T07:35,2022-03-09T19:14,41912.22,32980.75,5.05,5.25,0,0,0,0,0,NaN
10/03/22,51,14.8,11,7.8,5.8,20.1,225,33.1,16,2.72,2022-03-10T07:34,2022-03-10T19:15,42073.89,38912.88,4.8,5.25,0.4,0.3,0,0.7,3,NaN
11/03/22,53,11.6,6.9,7.5,3.3,25.3,228,42.8,4.96,1.43,2022-03-11T07:32,2022-03-11T19:16,42236.05,16334.62,2.8,5.25,4.3,0.2,0,4.5,11,NaN
12/03/22,53,12.7,7.5,4.8,1.4,33.5,245,38.5,18.12,2.6,2022-03-12T07:31,2022-03-12T19:17,42398.58,39121.93,5.4,5.4,1,0,0,1,2,NaN
13/03/22,81,12.8,9.8,4.6,1.6,28.8,224,48.6,18.76,2.78,2022-03-13T07:29,2022-03-13T19:18,42561.39,39187.53,5.35,5.55,9.6,0.3,0,9.9,6,NaN
14/03/22,71,12.5,9.5,4.3,-1.8,41.7,87,63.4,1.3,1.17,2022-03-14T07:27,2022-03-14T19:20,42724.35,1535.27,1.6,5.25,15.2,0.3,0.07,15.6,10,NaN
15/03/22,51,18.1,13.6,9.2,5.9,23.9,78,31.3,11.46,2.98,2022-03-15T07:26,2022-03-15T19:21,42887.38,36517.33,3.9,5.6,0,0.3,0,0.3,2,NaN
16/03/22,3,18.5,16.1,10.9,6.2,32.1,55,44.6,14.14,3.09,2022-03-16T07:24,2022-03-16T19:22,43050.35,38416.53,5.1,5.65,0,0,0,0,0,NaN
17/03/22,53,12.2,7.2,9,4,30.3,39,44.3,10.4,2.67,2022-03-17T07:22,2022-03-17T19:23,43213.17,34200.68,3.95,5.65,1.6,0.1,0,1.7,6,NaN
18/03/22,3,14.4,11.5,7.7,3.5,22.2,66,29.5,13.6,2.76,2022-03-18T07:21,2022-03-18T19:24,43375.74,32689.59,5.45,5.7,0,0,0,0,0,NaN
19/03/22,3,13.9,12.7,7.9,5.1,15.3,116,26.3,11.6,2.23,2022-03-19T07:19,2022-03-19T19:25,43537.93,28978.71,5.4,5.75,0,0,0,0,0,NaN
20/03/22,51,12.7,7.4,7.8,4,28.4,117,40.7,5.35,1.8,2022-03-20T07:17,2022-03-20T19:26,43699.66,19394.34,2,5.75,0,0.2,0,0.2,2,NaN
21/03/22,81,13.1,9.6,8.5,4.2,28.8,138,44.6,6.88,1.47,2022-03-21T07:16,2022-03-21T19:27,43860.8,19209.25,4.7,5.7,12.9,7.6,0,20.5,21,NaN
22/03/22,81,11.8,6.3,8.2,3.3,34.4,132,41,6.27,1.37,2022-03-22T07:14,2022-03-22T19:28,44021.25,21598.69,3.6,5.8,4.1,5.5,0,9.6,16,NaN
23/03/22,53,11.9,7,7.8,3.3,24.6,101,33.8,4.51,1.56,2022-03-23T07:13,2022-03-23T19:29,44180.92,8077.71,2.2,5.85,5,0,0,5,8,NaN
24/03/22,61,10.3,9,7.1,2.5,24,49,37.4,1.38,0.72,2022-03-24T07:11,2022-03-24T19:30,44339.85,0,0.75,5.8,10.4,0.5,0,10.9,19,NaN
25/03/22,55,11.9,9.6,8.4,4.1,22.7,51,39.6,3.31,0.95,2022-03-25T07:09,2022-03-25T19:31,44499.18,8152.93,1.9,5.9,3.3,1.5,0,4.8,11,NaN
26/03/22,51,11.9,10.1,7.9,3.9,23.6,51,38.2,4.39,1.03,2022-03-26T07:08,2022-03-26T19:32,44659.05,8289.82,2.9,6.05,0.4,0,0,0.4,3,NaN
27/03/22,51,14.2,11.2,8.7,7.3,16.1,105,15.5,10.55,1.95,2022-03-27T07:06,2022-03-27T19:33,44819.36,32899.14,3.65,6.2,0.5,0,0,0.5,4,NaN
28/03/22,51,17.2,14.6,8.1,4.6,20.6,81,19.4,18.14,3.34,2022-03-28T07:04,2022-03-28T19:34,44980.02,38141.59,5.8,6.3,0.4,0,0,0.4,1,NaN
29/03/22,53,17.9,17.2,10,8.2,13.6,44,25.9,19,3.27,2022-03-29T07:03,2022-03-29T19:35,45140.92,39734.46,5.5,6.4,0.2,2.1,0,2.3,8,NaN
30/03/22,51,12.1,10.1,8.4,5.9,16.1,12,27.7,5.42,1.27,2022-03-30T07:01,2022-03-30T19:36,45301.98,15340.32,2.35,6,0.8,0.5,0,1.3,9,NaN
31/03/22,51,13.3,8.3,6.2,2.5,31.4,303,34.2,17.31,3.04,2022-03-31T07:00,2022-03-31T19:37,45463.07,38853.77,5.55,6.2,0,0.1,0,0.1,1,NaN
01/04/22,51,10.5,6,5.2,-0.1,24.3,351,30.6,23.81,3.89,2022-04-01T06:58,2022-04-01T19:38,45624.12,42048.44,6.3,6.3,0,0.1,0,0.1,1,NaN
02/04/22,2,10.9,8.2,2.4,-1.8,25.5,11,24.1,24.35,3.95,2022-04-02T06:56,2022-04-02T19:39,45785,42233.48,6.4,6.4,0,0,0,0,0,NaN
03/04/22,3,10.7,6.3,1,-3.7,31.3,56,43.2,24.45,4.05,2022-04-03T06:55,2022-04-03T19:40,45945.63,42347.27,6.4,6.4,0,0,0,0,0,NaN
04/04/22,3,12.3,7.7,0.9,-5.9,30.1,50,45.4,20.55,4.04,2022-04-04T06:53,2022-04-04T19:42,46105.89,42134.97,5.85,6.5,0,0,0,0,0,NaN
05/04/22,3,12,8.4,3.8,-1.8,21.3,58,36.4,15.87,3.02,2022-04-05T06:51,2022-04-05T19:43,46265.7,40112.91,4.65,6.5,0,0,0,0,0,NaN
06/04/22,3,17,13.1,3.4,0.1,30,254,26.6,22.54,3.91,2022-04-06T06:50,2022-04-06T19:44,46424.92,38559.88,6.6,6.6,0,0,0,0,0,NaN
07/04/22,3,17.8,14.2,6,2.4,23.7,243,33.1,24.46,4.24,2022-04-07T06:48,2022-04-07T19:45,46583.46,42965.49,6.75,6.75,0,0,0,0,0,NaN
08/04/22,3,15.9,11.2,5.8,1.5,26.9,244,33.5,21.81,3.42,2022-04-08T06:46,2022-04-08T19:46,46741.21,42348.85,6.1,6.8,0,0,0,0,0,NaN
09/04/22,51,16.5,14.8,8.7,5.9,18.6,242,32,16.41,2.84,2022-04-09T06:45,2022-04-09T19:47,46898.06,36447.43,5.6,6.75,0,0.6,0,0.6,6,NaN
10/04/22,3,21.5,19.3,9.3,8.1,27.4,152,46.1,22.1,4.26,2022-04-10T06:43,2022-04-10T19:48,47053.9,43491.61,6.9,6.95,0,0,0,0,0,NaN
11/04/22,51,21.7,17.8,9.3,7,30.6,188,45.4,21.06,4.62,2022-04-11T06:42,2022-04-11T19:49,47208.59,41257.93,6.3,7,0,0.2,0,0.2,2,NaN
12/04/22,55,14.8,12.3,7.7,4.6,29.9,225,42.8,17.35,2.76,2022-04-12T06:40,2022-04-12T19:50,47362.05,41086.36,6.2,6.8,1.5,2.5,0,4,9,NaN
13/04/22,3,18,17.3,7.8,5.6,15.6,25,22.3,19.35,3.7,2022-04-13T06:39,2022-04-13T19:51,47514.3,40538.95,6.85,6.9,0,0,0,0,0,NaN
14/04/22,3,20.4,19.3,10.6,7.5,16.2,25,29.5,17.67,3.95,2022-04-14T06:37,2022-04-14T19:52,47666.43,33530.09,7.1,7.15,0,0,0,0,0,NaN
15/04/22,3,23.3,23.5,11.6,9.4,14.1,5,15.1,25.46,5.06,2022-04-15T06:36,2022-04-15T19:53,47818.58,44592.36,7.15,7.15,0,0,0,0,0,NaN
16/04/22,0,25.2,24.3,13.4,11.6,18.3,8,18,26.07,5.39,2022-04-16T06:34,2022-04-16T19:54,47970.63,44742.73,7.25,7.25,0,0,0,0,0,NaN
17/04/22,3,25,23.5,12.8,9.8,13.3,47,16.2,23.92,5.23,2022-04-17T06:33,2022-04-17T19:55,48122.51,44333.23,6.95,7.3,0,0,0,0,0,NaN
18/04/22,3,24.2,23.2,13.5,9.5,21.5,0,23.4,26.25,6.24,2022-04-18T06:31,2022-04-18T19:56,48274.08,44998.45,7.2,7.2,0,0,0,0,0,NaN
19/04/22,85,18.1,15.6,6.8,3.8,23.2,355,31.3,19.16,3.67,2022-04-19T06:30,2022-04-19T19:57,48425.25,43780.54,5.6,7.05,9.7,4.2,0.07,14,7,NaN
20/04/22,71,12.6,6.5,4.5,-0.3,30.7,3,49,14.66,2.52,2022-04-20T06:28,2022-04-20T19:58,48575.9,39020.34,4.45,6.95,32.3,0.1,0.07,32.5,13,NaN
21/04/22,3,16.3,14,5.5,2.7,26.7,238,36.4,26.2,4.51,2022-04-21T06:27,2022-04-21T19:59,48725.93,44697.53,7.15,7.15,0,0,0,0,0,NaN
22/04/22,81,10.5,5.4,6.1,2.4,36.5,207,45.4,4.35,1.12,2022-04-22T06:25,2022-04-22T20:00,48875.23,8051.09,3.9,6.9,17.9,1.3,0,19.2,16,NaN
23/04/22,53,11.8,6.9,4.9,-1.3,34.6,243,45.4,17.2,2.33,2022-04-23T06:24,2022-04-23T20:01,49023.66,36601.09,6.7,6.95,0.8,2.2,0,3,12,NaN
24/04/22,3,16.3,14,5,1.6,16.5,235,32,27.56,4.26,2022-04-24T06:23,2022-04-24T20:02,49171.12,45494.31,7.3,7.3,0,0,0,0,0,NaN
25/04/22,3,19.1,17.9,8.1,5.2,10.5,84,14.8,27.41,4.58,2022-04-25T06:21,2022-04-25T20:03,49317.49,45505.5,7.35,7.35,0,0,0,0,0,NaN
26/04/22,53,20.7,20.2,12.3,9.8,16.8,100,21.6,20.19,4.01,2022-04-26T06:20,2022-04-26T20:04,49462.64,36033.18,7.3,7.4,0.4,1.6,0,2,7,NaN
27/04/22,53,17.9,16.6,10.3,8.8,14.8,214,16.2,22.67,3.84,2022-04-27T06:18,2022-04-27T20:05,49606.45,40911.29,7.25,7.25,0,1.6,0,1.6,5,NaN
28/04/22,51,15.4,13.5,10.7,8.7,27,49,28.1,13.3,2.54,2022-04-28T06:17,2022-04-28T20:06,49748.78,30306.66,6.05,7.15,0,0.4,0,0.4,4,NaN
29/04/22,2,22.4,21.1,10.4,7.9,13.9,68,28.8,27.44,5.17,2022-04-29T06:16,2022-04-29T20:07,49889.51,46050.96,7.35,7.35,0,0,0,0,0,NaN
30/04/22,3,23.9,22.3,13.6,11.8,22.4,315,21.2,20.13,4.44,2022-04-30T06:15,2022-04-30T20:08,50028.49,40614.18,6.55,7.45,0,0,0,0,0,NaN
01/05/22,51,24.3,22.3,14.8,13.1,27.2,264,23,24.03,5.36,2022-05-01T06:13,2022-05-01T20:09,50165.6,39668.53,7.5,7.5,0.2,0.1,0,0.3,2,NaN
02/05/22,80,19.7,21.2,11.9,7,31.4,352,37.4,24.97,4.37,2022-05-02T06:12,2022-05-02T20:10,50300.7,45740.46,7.4,7.45,0.6,10.5,0,11.1,16,NaN
03/05/22,51,16.9,12.8,10.2,6.8,32.4,47,39.2,17.85,3.32,2022-05-03T06:11,2022-05-03T20:11,50433.79,45354.47,6.9,7.4,0,0.2,0,0.2,2,NaN
04/05/22,51,19.8,15.3,10.3,6.3,22.9,50,37.1,18.65,4.21,2022-05-04T06:10,2022-05-04T20:12,50565.9,42563.45,5.2,7.35,0,0.1,0,0.1,1,NaN
05/05/22,3,21.7,20.9,10.6,7.4,14.9,76,20.2,28.71,5.55,2022-05-05T06:08,2022-05-05T20:14,50697.14,46967.59,7.6,7.6,0,0,0,0,0,NaN
06/05/22,3,23.7,22,10.8,7.9,20.7,47,23,29.24,6.05,2022-05-06T06:07,2022-05-06T20:15,50827.41,47259.62,7.6,7.6,0,0,0,0,0,NaN
07/05/22,3,23.6,23,11.6,8,21.3,43,30.6,29.09,6.03,2022-05-07T06:06,2022-05-07T20:16,50956.58,47452.56,7.65,7.65,0,0,0,0,0,NaN
08/05/22,3,25.4,24.3,13.2,10.2,15.3,69,25.6,28.64,6.23,2022-05-08T06:05,2022-05-08T20:17,51084.54,47649.62,7.7,7.7,0,0,0,0,0,NaN
09/05/22,3,26.5,26.1,14.3,11.8,18.3,88,32.4,27.81,6.32,2022-05-09T06:04,2022-05-09T20:18,51211.17,45111.38,7.7,7.7,0,0,0,0,0,NaN
10/05/22,3,27.5,27,14.9,12,16.5,117,24.1,28.58,6.52,2022-05-10T06:03,2022-05-10T20:19,51336.35,47922.71,7.8,7.8,0,0,0,0,0,NaN
11/05/22,3,28.2,28.2,16.6,13.7,22.1,142,36.4,27.53,6.7,2022-05-11T06:02,2022-05-11T20:20,51459.96,48037.62,7.2,7.8,0,0,0,0,0,NaN
12/05/22,3,25.5,23.5,17.1,13.2,18.3,117,21.6,22.74,6.03,2022-05-12T06:01,2022-05-12T20:21,51581.86,47726.45,6.5,7.75,0,0,0,0,0,NaN
13/05/22,3,28.1,27.5,16.2,13.8,11.7,141,14.8,29.19,6.57,2022-05-13T06:00,2022-05-13T20:22,51701.93,48262.13,7.85,7.85,0,0,0,0,0,NaN
14/05/22,51,28.9,28.7,19,16.5,25.5,84,36,23.27,6.23,2022-05-14T05:59,2022-05-14T20:23,51820.05,43879.45,7.6,7.85,0,0.7,0,0.7,4,NaN
15/05/22,51,24.2,21.7,15.6,13.4,29.6,234,39.2,24.55,5.59,2022-05-15T05:58,2022-05-15T20:24,51936.07,47135.82,7.05,7.85,0,0.7,0,0.7,3,NaN
16/05/22,3,25,23.4,15,12.9,17.8,240,24.8,28.95,6.38,2022-05-16T05:57,2022-05-16T20:24,52049.87,48268.22,7.9,7.9,0,0,0,0,0,NaN
17/05/22,3,27.6,25.3,15.8,14.3,21.6,237,21.2,28.68,6.78,2022-05-17T05:56,2022-05-17T20:25,52161.29,48686.72,7.95,7.95,0,0,0,0,0,NaN
18/05/22,51,30.7,29.3,18.3,16.7,16.8,199,33.1,28.02,6.67,2022-05-18T05:55,2022-05-18T20:26,52270.21,48540.91,7.9,8,0,0.2,0,0.2,1,NaN
19/05/22,3,33.2,30.7,18.9,16.7,32.3,124,44.3,26.43,8.13,2022-05-19T05:54,2022-05-19T20:27,52376.48,48884.89,7.45,8,0,0,0,0,0,NaN
20/05/22,3,33.1,30.5,19.8,16.4,21.9,98,34.9,21.07,7.5,2022-05-20T05:53,2022-05-20T20:28,52479.96,48389.5,6.8,8,0,0,0,0,0,NaN
21/05/22,3,35,33.3,21,17.9,44.8,111,50.8,26.01,8.48,2022-05-21T05:53,2022-05-21T20:29,52580.49,45794.15,7.9,8.05,0,0,0,0,0,NaN
22/05/22,3,27.4,24.2,18.8,15.7,31.2,227,36.4,24.12,6.65,2022-05-22T05:52,2022-05-22T20:30,52677.95,49067.81,6.7,8,0,0,0,0,0,NaN
23/05/22,3,26.1,24.3,16.5,14.8,21.9,266,21.6,27.86,6.85,2022-05-23T05:51,2022-05-23T20:31,52772.29,45354.65,8.1,8.1,0,0,0,0,0,NaN
24/05/22,3,22.6,20.7,13.6,8.4,29,349,31.3,20.6,5.01,2022-05-24T05:51,2022-05-24T20:32,52864.3,39525.04,7.4,7.95,0,0,0,0,0,NaN
25/05/22,0,21.7,18.3,11.5,7.8,24.6,29,25.9,30.82,6.53,2022-05-25T05:50,2022-05-25T20:33,52954.09,49180.21,8,8,0,0,0,0,0,NaN
26/05/22,0,26.4,23.9,11.5,8.1,21.5,58,30.2,30.56,7.07,2022-05-26T05:49,2022-05-26T20:33,53041.53,49220.32,8.05,8.05,0,0,0,0,0,NaN
27/05/22,1,30.1,28,15.9,12,19.6,54,40.3,30.85,8.14,2022-05-27T05:49,2022-05-27T20:34,53126.56,49284.84,8.05,8.05,0,0,0,0,0,NaN
28/05/22,0,30.8,30.8,17.9,15.1,20.1,58,33.8,30.64,7.9,2022-05-28T05:48,2022-05-28T20:35,53209.07,49279.28,8.05,8.05,0,0,0,0,0,NaN
29/05/22,3,29.1,25.6,19.5,16.9,28,247,30.2,28.94,7.79,2022-05-29T05:48,2022-05-29T20:36,53288.97,49347.23,7.95,8.1,0,0,0,0,0,NaN
30/05/22,3,22.3,18.8,14.6,10.3,31,240,34.2,25.05,6.48,2022-05-30T05:47,2022-05-30T20:37,53366.17,49331.55,6.95,8.1,0,0,0,0,0,NaN
31/05/22,3,29.2,26.8,16.3,15,20.9,223,33.1,30.45,7.24,2022-05-31T05:47,2022-05-31T20:37,53440.57,49449.38,8.15,8.15,0,0,0,0,0,NaN
01/06/22,2,28.2,25.6,17.7,14.4,27.7,237,39.6,30.54,8.09,2022-06-01T05:46,2022-06-01T20:38,53512.08,49423.09,8.2,8.2,0,0,0,0,0,NaN
02/06/22,51,27.1,25.1,17.3,16.7,19.9,239,25.2,28.39,6.98,2022-06-02T05:46,2022-06-02T20:39,53580.59,49443.9,8.15,8.15,0,0.1,0,0.1,1,NaN
03/06/22,3,26.4,24.3,17.2,14.6,20.1,233,24.1,30.91,7.51,2022-06-03T05:45,2022-06-03T20:40,53646.03,49580.88,8.15,8.15,0,0,0,0,0,NaN
04/06/22,2,25.8,23.1,16.4,13.3,25.5,237,26.6,30.82,7.67,2022-06-04T05:45,2022-06-04T20:40,53708.28,49603.4,8.2,8.2,0,0,0,0,0,NaN
05/06/22,0,27.7,25.7,14.9,12.1,17.3,243,18,31.32,7.42,2022-06-05T05:45,2022-06-05T20:41,53767.26,49623.59,8.25,8.25,0,0,0,0,0,NaN
06/06/22,3,29.6,25.6,18.9,17.5,21.9,244,25.9,28.51,7.64,2022-06-06T05:44,2022-06-06T20:42,53822.87,49573.96,7.35,8.25,0,0,0,0,0,NaN
07/06/22,3,31.4,29.7,20.3,18.2,24.9,259,26.6,30.33,8.03,2022-06-07T05:44,2022-06-07T20:42,53875.02,49727.26,8.25,8.25,0,0,0,0,0,NaN
08/06/22,3,27.7,24.4,22,20.8,28.8,308,28.1,24.95,7.54,2022-06-08T05:44,2022-06-08T20:43,53923.61,49598.43,6.9,8.3,0,0,0,0,0,NaN
09/06/22,3,32.1,31.7,19.9,19.4,29.9,42,38.2,30.42,7.49,2022-06-09T05:44,2022-06-09T20:43,53968.55,49756.79,8.35,8.35,0,0,0,0,0,NaN
10/06/22,3,34.2,33.9,20.7,16.9,24.3,56,38.2,29.94,7.5,2022-06-10T05:44,2022-06-10T20:44,54009.74,49768.24,8.2,8.3,0,0,0,0,0,NaN
11/06/22,53,36.3,36.6,21.6,19.5,26.5,105,31.7,30.35,8.64,2022-06-11T05:44,2022-06-11T20:44,54047.11,49855.97,8.3,8.3,0,1.6,0,1.6,6,NaN
12/06/22,51,35.8,34.8,22.6,18.6,21.5,69,32,28.7,8.63,2022-06-12T05:43,2022-06-12T20:45,54080.59,49864.96,8.3,8.3,0,0.3,0,0.3,2,NaN
13/06/22,3,37.3,35.6,23.7,20.7,16.7,137,23.4,31.21,9.76,2022-06-13T05:43,2022-06-13T20:45,54110.47,49871.47,8.35,8.35,0,0,0,0,0,NaN
14/06/22,3,38.5,36.4,25.9,23.5,31,235,40.3,30.01,9.6,2022-06-14T05:43,2022-06-14T20:46,54136.79,49958.82,8.1,8.4,0,0,0,0,0,NaN
15/06/22,3,38.7,37.9,25.7,23.1,27.9,114,38.5,27.36,9.28,2022-06-15T05:43,2022-06-15T20:46,54159.55,49622.79,7.75,8.35,0,0,0,0,0,NaN
16/06/22,51,37.4,36.8,26.2,21,45.1,54,52.6,24.2,8.24,2022-06-16T05:43,2022-06-16T20:46,54178.75,44695.8,8.05,8.35,0,0.7,0,0.7,3,NaN
17/06/22,3,38.7,36.7,23.7,21.9,39.6,69,33.1,28.44,10.02,2022-06-17T05:44,2022-06-17T20:47,54194.38,49007.47,8.25,8.3,0,0,0,0,0,NaN
18/06/22,3,38.4,35.5,26.4,22.4,34.7,182,48.2,29.2,11.15,2022-06-18T05:44,2022-06-18T20:47,54206.44,50045.14,8.3,8.3,0,0,0,0,0,NaN
19/06/22,0,26.6,23.6,18.1,14.6,29.7,240,40,30.92,8.4,2022-06-19T05:44,2022-06-19T20:47,54214.93,50039.93,8.25,8.25,0,0,0,0,0,NaN
20/06/22,3,25.8,22.8,18.3,16.4,31.9,229,37.1,28.27,7.59,2022-06-20T05:44,2022-06-20T20:48,54219.86,49851.48,7.8,8.2,0,0,0,0,0,NaN
21/06/22,3,27.8,24.3,15.6,12.4,29.9,236,32.8,30.31,8,2022-06-21T05:44,2022-06-21T20:48,54221.23,50114.26,7.65,8.2,0,0,0,0,0,NaN
22/06/22,3,22.5,19.4,13.6,9.7,27.1,237,33.1,30.76,6.96,2022-06-22T05:44,2022-06-22T20:48,54219.04,50011.27,8,8.15,0,0,0,0,0,NaN
23/06/22,51,23.4,19.9,15.4,13.1,33.2,231,32,28.4,6.72,2022-06-23T05:45,2022-06-23T20:48,54213.31,47466.11,7.9,8.15,0,0.3,0,0.3,3,NaN
24/06/22,2,25.8,23.2,14,11.3,20.9,235,28.1,31.15,7.29,2022-06-24T05:45,2022-06-24T20:48,54204.04,49982.05,8.2,8.2,0,0,0,0,0,NaN
25/06/22,3,26.7,23,15.7,12.6,28.6,238,31.3,27.74,7.5,2022-06-25T05:45,2022-06-25T20:49,54191.25,49964.66,8,8.2,0,0,0,0,0,NaN
26/06/22,3,26,21.8,17.1,15.4,21.8,239,24.1,31.32,7.63,2022-06-26T05:46,2022-06-26T20:49,54174.94,50039.39,8.2,8.2,0,0,0,0,0,NaN
27/06/22,3,27.5,26.2,16.6,12.5,24.2,22,30.2,31.21,7.48,2022-06-27T05:46,2022-06-27T20:49,54155.13,50018.65,7.95,7.95,0,0,0,0,0,NaN
28/06/22,0,30.4,28.8,16.9,14.1,24.6,47,32,31.34,7.83,2022-06-28T05:47,2022-06-28T20:49,54131.84,50090.31,8.25,8.25,0,0,0,0,0,NaN
29/06/22,3,31.1,27.5,20.4,17.2,27.9,255,30.2,31.11,9.15,2022-06-29T05:47,2022-06-29T20:49,54105.08,50066.06,8.25,8.25,0,0,0,0,0,NaN
30/06/22,3,29,26.3,20.2,18.6,24.6,282,20.2,29.81,7.79,2022-06-30T05:47,2022-06-30T20:49,54074.88,49946.17,7.4,8.15,0,0,0,0,0,NaN
01/07/22,0,31.9,31.7,16.9,12.6,29,48,37.4,30.89,7.78,2022-07-01T05:48,2022-07-01T20:49,54041.24,49918.74,8.25,8.25,0,0,0,0,0,NaN
02/07/22,3,34.7,35.1,20.8,20.3,20,108,27.7,28.44,6.89,2022-07-02T05:48,2022-07-02T20:48,54004.15,49796.75,7.8,8.2,0,0,0,0,0,NaN
03/07/22,3,33.8,32.4,22.7,22.4,26.9,218,41,29.97,8.87,2022-07-03T05:49,2022-07-03T20:48,53963.21,49581.32,8.25,8.25,0,0,0,0,0,NaN
04/07/22,0,33.2,30.8,21.9,19.5,16.3,235,22.3,31.03,8.69,2022-07-04T05:49,2022-07-04T20:48,53918.46,49917.32,8.25,8.25,0,0,0,0,0,NaN
05/07/22,0,35.4,32.3,22.8,20.1,20.5,231,34.6,31.46,8.94,2022-07-05T05:50,2022-07-05T20:48,53869.99,49881.02,8.25,8.25,0,0,0,0,0,NaN
06/07/22,1,32.4,31.5,21.4,18,31.4,20,34.9,30.31,8.1,2022-07-06T05:51,2022-07-06T20:47,53817.9,49662.3,8.15,8.15,0,0,0,0,0,NaN
07/07/22,0,31.7,30,19.1,14.7,27.2,51,33.1,30.79,8.59,2022-07-07T05:51,2022-07-07T20:47,53762.3,49712.72,8.15,8.15,0,0,0,0,0,NaN
08/07/22,0,33.9,32.5,20.5,16.7,22.7,41,24.8,30.95,8.37,2022-07-08T05:52,2022-07-08T20:47,53703.29,49583.06,8.2,8.2,0,0,0,0,0,NaN
09/07/22,0,36.2,36.4,22.8,21.2,20.6,72,32.8,30.68,8.36,2022-07-09T05:52,2022-07-09T20:46,53640.96,49540.61,8.3,8.3,0,0,0,0,0,NaN
10/07/22,0,37,36.5,24.1,21.9,24.5,82,35.6,30.67,9.08,2022-07-10T05:53,2022-07-10T20:46,53575.44,49411.11,8.3,8.3,0,0,0,0,0,NaN
11/07/22,3,37.3,37.6,24.4,21.7,22.9,96,32,29.69,8.45,2022-07-11T05:54,2022-07-11T20:46,53506.8,49282.88,8.25,8.25,0,0,0,0,0,NaN
12/07/22,3,37.5,37.5,25.7,23.3,21.8,117,25.9,30.09,8.62,2022-07-12T05:55,2022-07-12T20:45,53435.19,49320.59,8.2,8.2,0,0,0,0,0,NaN
13/07/22,3,38.8,37.5,26.4,24,12.3,145,25.2,27.16,7.88,2022-07-13T05:55,2022-07-13T20:45,53360.68,49192.66,7.85,8.2,0,0,0,0,0,NaN
14/07/22,2,39.9,39.1,27.3,23.6,19.8,66,36.4,30.17,9.49,2022-07-14T05:56,2022-07-14T20:44,53283.38,49145.48,8.2,8.2,0,0,0,0,0,NaN
15/07/22,0,39,37.4,27.4,24,17.7,105,31.7,30.33,10.15,2022-07-15T05:57,2022-07-15T20:44,53203.39,49096.94,8.15,8.15,0,0,0,0,0,NaN
16/07/22,0,38.8,38,27,23.9,21.4,118,29.2,30.04,9.82,2022-07-16T05:58,2022-07-16T20:43,53120.82,49047.09,8.15,8.15,0,0,0,0,0,NaN
17/07/22,0,38.6,36.9,26.9,24.2,19.3,138,32.4,30.03,9.95,2022-07-17T05:59,2022-07-17T20:42,53035.78,48995.93,8.15,8.15,0,0,0,0,0,NaN
18/07/22,3,38.4,36.3,25.9,23.1,23.4,151,37.8,29.16,10.24,2022-07-18T05:59,2022-07-18T20:42,52948.35,46490.37,8.15,8.15,0,0,0,0,0,NaN
19/07/22,0,33,28.9,22.5,19.1,23.7,235,30.6,30.39,10.1,2022-07-19T06:00,2022-07-19T20:41,52858.64,48823.29,8.1,8.1,0,0,0,0,0,NaN
20/07/22,0,35.4,33.9,23.4,19.8,13.2,34,13,30.51,7.72,2022-07-20T06:01,2022-07-20T20:40,52766.75,48771.14,8.1,8.1,0,0,0,0,0,NaN
21/07/22,0,37.1,37.2,25,23.9,15,95,26.6,29.72,8,2022-07-21T06:02,2022-07-21T20:40,52672.79,48657.44,8.15,8.15,0,0,0,0,0,NaN
22/07/22,3,36.6,32.7,25.2,24,24.5,216,31,28.65,9.91,2022-07-22T06:03,2022-07-22T20:39,52576.7,48549.17,7.5,8.1,0,0,0,0,0,NaN
23/07/22,3,37.6,33.4,24.6,22.6,21.8,242,27.4,30.17,9.89,2022-07-23T06:03,2022-07-23T20:38,52477.66,48499.96,8.1,8.1,0,0,0,0,0,NaN
24/07/22,3,38.6,34.4,24.9,21.2,34.3,239,33.1,29.73,11.11,2022-07-24T06:04,2022-07-24T20:37,52375.62,48399.3,8.1,8.1,0,0,0,0,0,NaN
25/07/22,3,37,32.3,26.8,24.3,31.3,257,26.3,29.94,9.96,2022-07-25T06:05,2022-07-25T20:36,52270.75,48118.2,8.1,8.1,0,0,0,0,0,NaN
26/07/22,0,34.9,33.5,23.9,21.5,20.6,31,25.6,29.3,8.92,2022-07-26T06:06,2022-07-26T20:35,52163.19,48055.74,8,8,0,0,0,0,0,NaN
27/07/22,0,34.4,34.3,23.2,21.1,25.8,40,35.6,28.67,8.86,2022-07-27T06:07,2022-07-27T20:34,52053.08,47821.73,8.05,8.05,0,0,0,0,0,NaN
28/07/22,0,34.7,31.8,25,23,26.4,242,24.1,29.11,8.97,2022-07-28T06:08,2022-07-28T20:34,51940.56,47806.54,8,8,0,0,0,0,0,NaN
29/07/22,0,35.6,33,24.6,23,17.5,251,31,29.07,8.55,2022-07-29T06:09,2022-07-29T20:33,51825.77,47789.4,8.05,8.05,0,0,0,0,0,NaN
30/07/22,53,36.2,38.1,23,20.9,49.5,58,41.4,25.55,8.23,2022-07-30T06:10,2022-07-30T20:32,51708.85,41509.21,7.95,7.95,0.6,0.1,0,0.7,2,NaN
31/07/22,2,36.3,37.1,24,24,14.9,81,20.9,28.29,7.33,2022-07-31T06:11,2022-07-31T20:30,51589.94,47452.55,7.95,7.95,0,0,0,0,0,NaN
01/08/22,2,37.4,37.8,25.8,25.1,22.9,84,31.7,28.32,8.55,2022-08-01T06:12,2022-08-01T20:29,51469.17,47345.94,7.95,7.95,0,0,0,0,0,NaN
02/08/22,3,37.9,38.7,26.3,25.9,24.2,73,39.6,24.97,8.07,2022-08-02T06:13,2022-08-02T20:28,51346.68,43897.29,7.85,7.85,0,0,0,0,0,NaN
03/08/22,51,37.3,36,26.4,24.9,15,150,27,28.36,8.41,2022-08-03T06:14,2022-08-03T20:27,51222.58,47277.96,7.85,7.85,0,0.1,0,0.1,1,NaN
04/08/22,3,36.3,34.4,25.2,22.7,18.7,143,28.1,28.4,8.65,2022-08-04T06:15,2022-08-04T20:26,51097.01,47117.08,7.85,7.85,0,0,0,0,0,NaN
05/08/22,0,35.8,34.5,24.6,23.4,19.5,137,35.6,28.25,8.01,2022-08-05T06:16,2022-08-05T20:25,50970.09,47041.13,7.85,7.85,0,0,0,0,0,NaN
06/08/22,0,35.6,35.7,24.9,22.6,19.4,99,24.1,27.97,7.81,2022-08-06T06:17,2022-08-06T20:24,50841.93,46886.04,7.8,7.8,0,0,0,0,0,NaN
07/08/22,0,35,32.4,24.7,23,18.7,156,24.1,28.2,8.25,2022-08-07T06:17,2022-08-07T20:23,50712.68,46809.27,7.85,7.85,0,0,0,0,0,NaN
08/08/22,0,35.4,35.3,24.5,22.5,11.3,133,19.1,27.9,7.08,2022-08-08T06:18,2022-08-08T20:21,50582.43,46660.82,7.8,7.8,0,0,0,0,0,NaN
09/08/22,3,36.7,36.1,24.7,22.6,24.9,124,31.3,27.53,8.86,2022-08-09T06:19,2022-08-09T20:20,50451.3,46517.93,7.8,7.8,0,0,0,0,0,NaN
10/08/22,51,37.3,36,25.2,22.9,28.4,110,33.5,26.48,9.54,2022-08-10T06:20,2022-08-10T20:19,50319.4,43297.32,7.7,7.75,0,0.2,0,0.2,2,NaN
11/08/22,2,35.1,35,24.9,23.8,21.9,149,28.8,26.91,7.64,2022-08-11T06:21,2022-08-11T20:18,50186.69,46307.57,7.75,7.75,0,0,0,0,0,NaN
12/08/22,1,36.1,34.2,25.5,24.6,18.1,213,34.6,26.95,8.07,2022-08-12T06:22,2022-08-12T20:16,50052.15,46178,7.75,7.75,0,0,0,0,0,NaN
13/08/22,53,31.2,30.2,23.3,19.2,37.9,196,54.7,7.24,5.12,2022-08-13T06:23,2022-08-13T20:15,49915.71,19022.73,3.7,7.65,0.7,0.8,0,1.5,4,NaN
14/08/22,3,31.5,26.3,19.7,18.1,24.1,238,37.8,27.66,8.6,2022-08-14T06:24,2022-08-14T20:14,49777.48,46027.03,7.55,7.55,0,0,0,0,0,NaN
15/08/22,0,30.4,27.3,21.4,19.2,22.3,238,22.7,27.18,7.7,2022-08-15T06:25,2022-08-15T20:12,49637.62,45907.93,7.6,7.6,0,0,0,0,0,NaN
16/08/22,3,28.8,24.3,19.9,16.2,33.2,252,32.8,26.82,8.69,2022-08-16T06:26,2022-08-16T20:11,49496.24,45831.09,7.45,7.45,0,0,0,0,0,NaN
17/08/22,51,27.4,27.5,18.9,17.3,22.2,347,18.7,24.22,6.18,2022-08-17T06:27,2022-08-17T20:10,49353.46,41634.49,7.35,7.35,0,0.4,0,0.4,2,NaN
18/08/22,1,28.1,26.3,17,14.2,22,52,22.7,26.63,6.74,2022-08-18T06:28,2022-08-18T20:08,49209.43,45664.93,7.45,7.45,0,0,0,0,0,NaN
19/08/22,0,30.6,29.4,18.2,15.3,22.9,57,26.6,26.7,6.2,2022-08-19T06:29,2022-08-19T20:07,49064.25,45588.34,7.45,7.45,0,0,0,0,0,NaN
20/08/22,0,33.8,33,21.8,19.2,17.8,78,30.2,26.17,7.36,2022-08-20T06:30,2022-08-20T20:05,48918.04,45497.12,7.45,7.45,0,0,0,0,0,NaN
21/08/22,3,35.6,33.4,24.5,21.8,20.7,323,20.2,25.39,7.61,2022-08-21T06:31,2022-08-21T20:04,48770.92,45411.75,7.2,7.45,0,0,0,0,0,NaN
22/08/22,3,33.5,32.9,23.2,20.5,24.4,47,34.2,25.36,7.41,2022-08-22T06:32,2022-08-22T20:02,48623.01,45325.5,7.45,7.45,0,0,0,0,0,NaN
23/08/22,0,35.6,36.3,23.1,21.3,23.8,60,32,25.18,7.28,2022-08-23T06:33,2022-08-23T20:01,48474.41,45200.16,7.4,7.4,0,0,0,0,0,NaN
24/08/22,3,35.2,33.7,24.7,24.4,19.4,196,24.8,23.59,7.49,2022-08-24T06:34,2022-08-24T19:59,48325.23,45057.28,6.7,7.35,0,0,0,0,0,NaN
25/08/22,1,33.5,34.2,23.7,21.1,31.8,19,43.9,25.12,7.23,2022-08-25T06:35,2022-08-25T19:58,48175.59,44913.77,7.3,7.3,0,0,0,0,0,NaN
26/08/22,53,32.3,33.1,21.8,20.2,27.1,48,35.3,23.47,6.92,2022-08-26T06:36,2022-08-26T19:56,48025.58,43575.16,7.2,7.2,0,1.1,0,1.1,4,NaN
27/08/22,3,32,31.7,21.9,20.4,18.4,93,18,24.01,5.73,2022-08-27T06:37,2022-08-27T19:55,47875.32,44625.23,7.15,7.15,0,0,0,0,0,NaN
28/08/22,1,33.8,32.6,23.2,21.7,21.9,123,34.6,23.99,7.52,2022-08-28T06:38,2022-08-28T19:53,47724.9,44375.29,7.15,7.15,0,0,0,0,0,NaN
29/08/22,53,32.8,30.9,23,22.5,34.6,204,40.3,24.12,7.8,2022-08-29T06:39,2022-08-29T19:52,47574.41,44171.7,7.15,7.15,0,1.2,0,1.2,6,NaN
30/08/22,3,32.9,29.2,23.4,22.2,23.4,235,35.6,24.73,8.16,2022-08-30T06:40,2022-08-30T19:50,47423.97,44079.12,7.1,7.1,0,0,0,0,0,NaN
31/08/22,3,30.4,26.3,20.5,17.2,22.2,235,36.4,24.76,8.69,2022-08-31T06:41,2022-08-31T19:48,47273.52,43881.5,7.05,7.05,0,0,0,0,0,NaN
01/09/22,3,31.1,28.1,20.8,17.5,22.9,246,24.5,24.11,7.49,2022-09-01T06:42,2022-09-01T19:47,47122,43110.23,7.05,7.05,0,0,0,0,0,NaN
02/09/22,3,28.7,24.3,19.4,16.3,26.7,240,25.6,22.53,7.7,2022-09-02T06:43,2022-09-02T19:45,46969.33,42771.29,6.9,6.95,0,0,0,0,0,NaN
03/09/22,3,27.2,24,18,15.4,23.1,236,26.3,23.5,7.02,2022-09-03T06:44,2022-09-03T19:44,46815.59,43063.16,6.7,6.85,0,0,0,0,0,NaN
04/09/22,3,27.4,24.1,17.5,14.5,18.6,239,24.8,22.87,6.99,2022-09-04T06:45,2022-09-04T19:42,46660.91,42986.07,6.5,6.9,0,0,0,0,0,NaN
05/09/22,2,27.4,23.6,17.7,15.1,22.8,237,29.9,23.79,7.04,2022-09-05T06:46,2022-09-05T19:40,46505.39,42757.02,6.8,6.8,0,0,0,0,0,NaN
06/09/22,1,27.6,24.3,17.3,15.2,27.5,239,27.4,23.26,6.8,2022-09-06T06:46,2022-09-06T19:39,46349.12,42617.09,6.8,6.8,0,0,0,0,0,NaN
07/09/22,3,25.5,20.4,17,14.1,27,246,23,19.44,6.44,2022-09-07T06:47,2022-09-07T19:37,46192.22,42332.91,6.25,6.75,0,0,0,0,0,NaN
08/09/22,3,28.3,26.6,19.4,17.9,16.6,254,17.6,20.96,5.53,2022-09-08T06:48,2022-09-08T19:35,46034.79,42277.16,6.65,6.7,0,0,0,0,0,NaN
09/09/22,3,31.1,30.1,20.3,21.1,14,266,15.5,21.64,5.14,2022-09-09T06:49,2022-09-09T19:34,45876.91,42260.77,6.65,6.65,0,0,0,0,0,NaN
10/09/22,1,32.5,31.5,21.7,19.5,15,354,23.4,22.38,6.37,2022-09-10T06:50,2022-09-10T19:32,45718.69,42166.82,6.6,6.6,0,0,0,0,0,NaN
11/09/22,51,34.3,32,23,22,25.8,165,41.8,22.14,6.08,2022-09-11T06:51,2022-09-11T19:30,45560.23,42109.13,6.6,6.6,0,0.7,0,0.7,3,NaN
12/09/22,53,29.9,28.3,22.9,19.8,53,184,80.3,15.31,6.04,2022-09-12T06:52,2022-09-12T19:29,45401.61,33544.78,6.25,6.6,0.6,0.7,0,1.3,6,NaN
13/09/22,53,25.3,21.8,19,16.9,34,211,74.9,13.82,5,2022-09-13T06:53,2022-09-13T19:27,45242.95,33247.89,6.25,6.3,0.8,2.7,0,3.5,10,NaN
14/09/22,51,23.7,20.3,16.3,15.1,24.4,234,34.6,18.83,4.76,2022-09-14T06:54,2022-09-14T19:25,45084.32,41905.78,5.7,6.3,0,0.2,0,0.2,2,NaN
15/09/22,51,23.7,22.8,17.6,16.3,15.9,240,29.5,16.54,4.11,2022-09-15T06:55,2022-09-15T19:24,44925.82,33839.04,6.15,6.25,0.1,0.6,0,0.7,6,NaN
16/09/22,3,26.7,26.8,19.7,19.9,10.5,298,8.3,20.75,4.39,2022-09-16T06:56,2022-09-16T19:22,44767.55,41592.44,6.3,6.3,0,0,0,0,0,NaN
17/09/22,3,27.6,26.2,18.8,15.6,20.9,48,30.6,21.2,5.93,2022-09-17T06:57,2022-09-17T19:20,44609.59,41435.87,6.25,6.3,0,0,0,0,0,NaN
18/09/22,53,28.3,27.5,19.3,17.7,22.4,100,25.9,20.09,5.42,2022-09-18T06:58,2022-09-18T19:19,44452.05,41279.49,6,6.2,0,1.5,0,1.5,3,NaN
19/09/22,55,27.5,28.4,19.9,20.3,10.6,147,11.9,18,4.12,2022-09-19T06:59,2022-09-19T19:17,44295,40429.53,6.05,6.15,0,2.5,0,2.5,7,NaN
20/09/22,51,28,27.1,20.3,19.1,14,61,20.9,20.06,4.82,2022-09-20T07:00,2022-09-20T19:15,44138.38,40967.25,6.05,6.05,0,0.9,0,0.9,3,NaN
21/09/22,51,28.2,28.6,20.8,19.2,25.9,174,20.5,20.31,5.13,2022-09-21T07:01,2022-09-21T19:14,43981.12,40810.09,6.05,6.05,0,0.1,0,0.1,1,NaN
22/09/22,3,27.7,26.3,19.5,19,15.9,221,19.8,19.38,5.22,2022-09-22T07:02,2022-09-22T19:12,43823.11,40651.95,6,6,0,0,0,0,0,NaN
23/09/22,3,26.2,22.5,20.3,18,19.7,236,20.5,17.84,6.1,2022-09-23T07:03,2022-09-23T19:10,43664.44,40492.93,5.3,6,0,0,0,0,0,NaN
24/09/22,3,24.7,22,18.6,13.7,28,298,22,19.05,6.18,2022-09-24T07:04,2022-09-24T19:09,43505.21,39511.51,5.7,5.85,0,0,0,0,0,NaN
25/09/22,3,20.9,16.3,14,8.9,28.4,46,38.5,16.93,5.55,2022-09-25T07:05,2022-09-25T19:07,43345.53,37790.66,5.1,5.8,0,0,0,0,0,NaN
26/09/22,51,22,19.5,13.5,8.9,30.6,33,41.8,19.75,5.23,2022-09-26T07:06,2022-09-26T19:05,43185.49,39991.76,5.75,5.75,0,0.6,0,0.6,4,NaN
27/09/22,3,23.4,19.4,14.9,12.9,24.1,300,15.8,19.71,4.65,2022-09-27T07:07,2022-09-27T19:04,43025.2,39850.11,5.75,5.75,0,0,0,0,0,NaN
28/09/22,3,22.6,17.3,16,13.2,32.4,302,36.7,16.65,5.27,2022-09-28T07:08,2022-09-28T19:02,42864.75,39514.13,5.05,5.7,0,0,0,0,0,NaN
29/09/22,51,18.1,14.1,13.5,8.9,27.7,286,31.3,9.45,3.63,2022-09-29T07:09,2022-09-29T19:00,42704.25,29439.59,3.9,5.55,0,0.5,0,0.5,3,NaN
30/09/22,3,19.4,17.7,12.6,9.3,14.2,14,20.5,19.32,3.96,2022-09-30T07:10,2022-09-30T18:59,42543.8,39157.45,5.6,5.6,0,0,0,0,0,NaN
01/10/22,3,22.7,20.4,13.8,11.7,8.3,163,7.6,18.67,3.38,2022-10-01T07:11,2022-10-01T18:57,42383.48,38520.58,5.6,5.6,0,0,0,0,0,NaN
02/10/22,3,26.3,22.5,16.3,13.8,10,55,14,18.75,4.65,2022-10-02T07:12,2022-10-02T18:55,42223.43,38806.49,5.55,5.55,0,0,0,0,0,NaN
03/10/22,3,28,25.9,18.3,14.6,9.7,47,13.7,16.75,4.43,2022-10-03T07:13,2022-10-03T18:54,42063.71,37647.21,5.45,5.45,0,0,0,0,0,NaN
04/10/22,1,28.8,26.2,19.1,16.3,14.3,294,19.1,18.33,4.95,2022-10-04T07:14,2022-10-04T18:52,41904.45,38277.5,5.4,5.4,0,0,0,0,0,NaN
05/10/22,0,26.9,25.3,18.3,15.9,13.2,93,19.1,17.9,4.46,2022-10-05T07:15,2022-10-05T18:50,41745.75,37943.4,5.35,5.35,0,0,0,0,0,NaN
06/10/22,3,25.1,23.3,18.3,15.9,16.9,106,22.7,17.55,4.45,2022-10-06T07:16,2022-10-06T18:49,41587.7,37592.11,5.25,5.25,0,0,0,0,0,NaN
07/10/22,3,23.2,22.6,16.4,15.9,12.6,125,14.8,14.67,2.94,2022-10-07T07:17,2022-10-07T18:47,41430.42,36425.48,5.15,5.2,0,0,0,0,0,NaN
08/10/22,3,24.9,23.5,17.3,15.6,15.4,53,21.6,16.82,3.96,2022-10-08T07:18,2022-10-08T18:46,41274.02,37049.3,5.15,5.15,0,0,0,0,0,NaN
09/10/22,51,23.8,23.5,16.2,14.8,18.6,109,19.8,16.87,3.45,2022-10-09T07:19,2022-10-09T18:44,41118.58,36688.42,5.1,5.1,0,1.3,0,1.3,5,NaN
10/10/22,53,22.3,19.5,17.9,17.2,18.1,185,19.8,11.32,3.12,2022-10-10T07:20,2022-10-10T18:43,40964.06,35439.93,4.35,5.05,0,1.6,0,1.6,3,NaN
11/10/22,3,22.3,21.6,17.7,15.8,10.8,66,11.5,14.01,3.03,2022-10-11T07:21,2022-10-11T18:41,40809.29,33934.51,4.95,5,0,0,0,0,0,NaN
12/10/22,1,22.6,21.4,16,14.6,11,52,12.2,16.43,3.49,2022-10-12T07:22,2022-10-12T18:39,40654.12,36462.34,4.95,4.95,0,0,0,0,0,NaN
13/10/22,3,23.4,21.1,16.6,14.5,13.8,211,14.8,14.55,3.67,2022-10-13T07:23,2022-10-13T18:38,40498.68,36072.49,4.95,5,0,0,0,0,0,NaN
14/10/22,3,25.6,23,17.1,15.6,11.7,237,17.6,16.01,3.79,2022-10-14T07:24,2022-10-14T18:36,40343.07,36135.39,4.95,4.95,0,0,0,0,0,NaN
15/10/22,3,25.7,23,17.9,16.5,15,225,33.1,16.02,4,2022-10-15T07:25,2022-10-15T18:35,40187.42,36081.56,4.85,4.85,0,0,0,0,0,NaN
16/10/22,3,25.8,22.9,16.7,14.1,15.7,206,31.7,12.57,3.84,2022-10-16T07:26,2022-10-16T18:33,40031.84,36001.5,3.9,4.75,0,0,0,0,0,NaN
17/10/22,51,24.6,22.8,17.1,15.7,24.5,169,35.3,11.96,3.45,2022-10-17T07:27,2022-10-17T18:32,39876.46,34231.13,4.1,4.7,0.3,0.2,0,0.5,2,NaN
18/10/22,3,27.4,24.2,17.3,16.7,22.2,183,34.6,12.88,3.92,2022-10-18T07:28,2022-10-18T18:30,39721.4,36000,4.25,4.7,0,0,0,0,0,NaN
19/10/22,53,26,19.7,17.8,12.4,45.1,216,74.5,9.63,4.66,2022-10-19T07:30,2022-10-19T18:29,39566.77,26922.56,4.45,4.65,0.2,3.3,0,3.5,10,NaN
20/10/22,63,19.7,16.5,14.8,11.2,45.4,215,73.4,4.36,2.49,2022-10-20T07:31,2022-10-20T18:27,39412.71,17763.28,2.85,4.45,7.1,1.3,0,8.4,11,NaN
21/10/22,55,17.5,14.6,14.6,12.6,28.4,224,41.8,5.45,1.68,2022-10-21T07:32,2022-10-21T18:26,39259.34,20191.63,2.5,4.4,1.5,3.1,0,4.6,14,NaN
22/10/22,53,22.8,19.5,13.8,13.2,32.5,203,46.1,11.63,2.98,2022-10-22T07:33,2022-10-22T18:25,39106.8,28625.54,4.25,4.35,0,2.3,0,2.3,6,NaN
23/10/22,80,18.2,15.2,14.6,10.3,40.4,224,68.8,11.1,2.66,2022-10-23T07:34,2022-10-23T18:23,38955.2,35518.91,4.15,4.2,0.2,5.8,0,6,12,NaN
24/10/22,3,17.8,15.7,13.1,11.7,12.8,231,24.8,8.37,1.82,2022-10-24T07:35,2022-10-24T18:22,38804.69,33909.13,3.2,4.25,0,0,0,0,0,NaN
25/10/22,3,24.3,18.5,14.7,12.9,33.3,233,72,12.12,3.47,2022-10-25T07:36,2022-10-25T18:20,38655.39,35351.85,4.1,4.25,0,0,0,0,0,NaN
26/10/22,3,23.1,21.5,16.2,16,12.9,216,29.2,10.75,2.62,2022-10-26T07:37,2022-10-26T18:19,38507.47,34089.86,3.9,4.2,0,0,0,0,0,NaN
27/10/22,3,25.2,22.8,18,15.5,10.1,71,19.1,9.62,2.98,2022-10-27T07:38,2022-10-27T18:18,38361.04,35041.91,3.4,4.2,0,0,0,0,0,NaN
28/10/22,3,25.2,23.1,17.3,15.2,12,96,19.8,9.88,3.13,2022-10-28T07:40,2022-10-28T18:16,38216.27,34889.18,3.65,4.15,0,0,0,0,0,NaN
29/10/22,3,24.2,22,16.4,14.3,10.2,90,15.5,11.55,3.23,2022-10-29T07:41,2022-10-29T18:15,38073.29,34738.12,3.85,4.15,0,0,0,0,0,NaN
30/10/22,3,20.1,17.9,15.1,14.3,22.7,237,23,9.24,2.24,2022-10-30T07:42,2022-10-30T18:14,37932.05,34588.57,3.35,4,0,0,0,0,0,NaN
31/10/22,51,17.5,15.7,14.2,12.4,20.1,208,62.3,3.12,1.54,2022-10-31T07:43,2022-10-31T18:13,37791.29,10777,1.6,3.95,0.2,0,0,0.2,1,NaN
01/11/22,51,19.9,16.8,14,12.8,16.1,231,25.2,8.03,1.94,2022-11-01T07:44,2022-11-01T18:12,37650.87,23898.52,3.85,3.85,0,0.1,0,0.1,1,NaN
02/11/22,3,19.6,18.1,13.4,11.8,11,249,18.4,11.39,2.21,2022-11-02T07:45,2022-11-02T18:10,37510.93,34059.03,3.6,3.85,0,0,0,0,0,NaN
03/11/22,51,17,14.5,12.5,8.8,29.6,241,40,7.76,2.33,2022-11-03T07:46,2022-11-03T18:09,37371.59,22531.79,3.75,3.8,0.3,0,0,0.3,3,NaN
04/11/22,3,17,12.8,10.6,6.4,19.5,293,24.5,11.65,2.7,2022-11-04T07:48,2022-11-04T18:08,37233.02,33844.81,3.7,3.8,0,0,0,0,0,NaN
05/11/22,3,16.5,13,8.8,5.5,8.4,107,9.7,12.81,2.4,2022-11-05T07:49,2022-11-05T18:07,37095.35,33697.71,3.8,3.8,0,0,0,0,0,NaN
06/11/22,3,18,14.5,10,6.6,16.6,232,20.5,12.24,2.85,2022-11-06T07:50,2022-11-06T18:06,36958.72,33551.54,3.7,3.75,0,0,0,0,0,NaN
07/11/22,3,17.4,14.9,10.4,8.6,12.2,204,28.1,11.32,2.16,2022-11-07T07:51,2022-11-07T18:05,36823.3,33147.25,3.65,3.65,0,0,0,0,0,NaN
08/11/22,53,16.1,12.9,12.2,10.5,23.1,226,40.3,4.44,1.42,2022-11-08T07:52,2022-11-08T18:04,36689.23,17167.85,2.35,3.4,0.6,0,0,0.6,1,NaN
09/11/22,53,17.2,14.6,12.6,10.4,16.9,247,29.9,6.78,1.58,2022-11-09T07:54,2022-11-09T18:03,36556.67,22296.27,3.1,3.45,1.3,1.3,0,2.6,10,NaN
10/11/22,0,16.3,13.7,10,7.7,13.2,51,24.1,11.85,2.12,2022-11-10T07:55,2022-11-10T18:02,36425.78,32979.44,3.5,3.5,0,0,0,0,0,NaN
11/11/22,53,16.3,13.1,10.2,6.7,18.9,68,27,8.83,2.28,2022-11-11T07:56,2022-11-11T18:01,36296.73,29026.59,3.2,3.35,0,2,0,2,6,NaN
12/11/22,80,19.3,14.7,11.8,9.2,34.2,111,47.2,6.7,2.17,2022-11-12T07:57,2022-11-12T18:00,36169.67,22221.41,3.15,3.35,2.1,6.2,0,8.3,19,NaN
13/11/22,3,17.5,15.6,11.3,9.7,11,62,18,11.13,1.9,2022-11-13T07:58,2022-11-13T17:59,36044.79,32568.61,3.4,3.4,0,0,0,0,0,NaN
14/11/22,51,14.3,11.3,10.3,8,22.5,233,40.7,5.09,1.19,2022-11-14T07:59,2022-11-14T17:58,35922.25,23833.37,2.4,3.25,0,0.4,0,0.4,3,NaN
15/11/22,51,16.1,11.2,11.5,7.8,39.6,232,54,5.32,1.23,2022-11-15T08:01,2022-11-15T17:57,35802.21,18623.25,3.3,3.3,0.5,0.8,0,1.3,9,NaN
16/11/22,61,13.2,11,9.5,6.7,28.5,241,49,3.77,0.8,2022-11-16T08:02,2022-11-16T17:56,35684.88,4953.69,1.65,3.25,0.5,0,0,0.5,4,NaN
17/11/22,53,16.7,13.9,11.4,10,25.3,240,58,5.41,1.04,2022-11-17T08:03,2022-11-17T17:56,35570.41,15292.14,2.15,3.2,0.2,0,0,0.4,2,NaN
18/11/22,61,12.9,9.4,7.2,3.8,21,278,47.2,8.23,1.5,2022-11-18T08:04,2022-11-18T17:55,35459.01,23161.36,3.15,3.2,0.4,0.3,0,0.6,2,NaN
19/11/22,3,11.2,6.1,5.2,1.8,19.9,297,44.6,9.99,1.94,2022-11-19T08:05,2022-11-19T17:54,35350.67,30294.7,3.15,3.15,0,0,0,0,0,NaN
20/11/22,3,15.3,12.8,6.2,3.6,14.7,248,32,9.3,1.49,2022-11-20T08:06,2022-11-20T17:53,35244.22,29280.6,3.1,3.1,0,0,0,0,0,NaN
21/11/22,95,13.6,11.2,7.7,2.3,25.6,254,67,1.97,0.93,2022-11-21T08:07,2022-11-21T17:53,35139.53,4173.44,1.75,2.9,1.8,7.5,0,9.4,6,NaN
22/11/22,61,11.5,9.1,5.4,2,24.3,248,59,4.43,0.96,2022-11-22T08:08,2022-11-22T17:52,35036.73,12476.41,2.1,2.95,2.2,0,0,2.6,4,NaN
23/11/22,61,15.3,14.7,12.1,9.7,25,240,56.9,2.78,0.58,2022-11-23T08:10,2022-11-23T17:52,34935.97,7288.53,2.35,3,0.9,0,0,1.3,8,NaN
24/11/22,80,14.4,13.1,9.4,8.4,12,222,39.6,3.47,0.67,2022-11-24T08:11,2022-11-24T17:51,34837.37,4733.42,1.5,2.9,0,0.9,0,0.9,4,NaN
25/11/22,80,14.5,12.5,7.6,5.3,13.3,286,36.4,9.69,1.56,2022-11-25T08:12,2022-11-25T17:51,34741.07,30758.22,2.95,2.95,0,0.7,0,0.7,4,NaN
26/11/22,3,13.2,10.9,2.9,0.4,4,43,11.9,10.49,1.3,2022-11-26T08:13,2022-11-26T17:50,34647.22,29915.54,2.95,3,0,0,0,0,0,NaN
27/11/22,45,13.5,11,2.1,-0.4,5.9,72,16.9,9.06,1.18,2022-11-27T08:14,2022-11-27T17:50,34555.95,29296.79,2.8,2.95,0,0,0,0,0,NaN
28/11/22,80,12.9,9.2,4.8,2.2,11.8,286,31.3,10.04,1.51,2022-11-28T08:15,2022-11-28T17:49,34467.4,30064.04,2.9,2.9,0,0.1,0,1.1,2,NaN
29/11/22,45,11.7,9.4,1,-1.3,4.7,356,14,10.02,1.18,2022-11-29T08:16,2022-11-29T17:49,34381.73,30243.59,2.85,2.85,0,0,0,0,0,NaN
30/11/22,3,11.1,8.8,3,0.6,5.1,40,14.8,7.54,0.98,2022-11-30T08:17,2022-11-30T17:49,34299.07,24670.12,2.35,2.8,0,0,0,0,0,NaN
01/12/22,3,12.7,8.4,4.8,1.9,15,38,38.2,10.07,1.68,2022-12-01T08:18,2022-12-01T17:48,34219.57,30137.24,2.8,2.8,0,0,0,0,0,NaN
02/12/22,3,10,7.9,3.5,0.2,10.7,33,29.5,7.66,1.11,2022-12-02T08:19,2022-12-02T17:48,34143.39,29280.31,2.2,2.7,0,0,0,0,0,NaN
03/12/22,3,10.1,6.9,-0.1,-2.7,8.7,303,24.1,6.92,0.92,2022-12-03T08:20,2022-12-03T17:48,34070.66,21737.21,2.6,2.8,0.4,0,0,0.4,2,NaN
04/12/22,61,6.8,4.9,3.7,0.7,5.7,32,15.5,2.74,0.44,2022-12-04T08:21,2022-12-04T17:48,34001.54,1998.24,1.05,2.6,1.8,0,0,2,3,NaN
05/12/22,61,8.7,7.8,3.8,1.5,8.7,43,21.2,1.7,0.34,2022-12-05T08:22,2022-12-05T17:48,33936.17,0,0.55,2.5,10.8,0,0,13.4,16,NaN
06/12/22,61,11.8,11.1,8.3,7,5.7,30,15.5,3.28,0.55,2022-12-06T08:23,2022-12-06T17:48,33874.71,3208.9,1.9,2.7,0.5,0,0,1,6,NaN
07/12/22,45,12.2,11.6,7.1,5.9,4.5,55,13.3,5.62,0.73,2022-12-07T08:24,2022-12-07T17:47,33817.29,27478.75,2.65,2.7,0,0.1,0,0.1,1,NaN
08/12/22,95,12,11.1,7.8,6.4,12.8,157,32,1.45,0.35,2022-12-08T08:25,2022-12-08T17:47,33764.08,0,0.95,2.45,20.1,10.4,0,35.8,19,NaN
09/12/22,95,11.1,10.4,8.7,7.3,7.6,182,25.2,1.78,0.37,2022-12-09T08:26,2022-12-09T17:47,33715.12,0,0.65,2.4,1,4.5,0,7.5,11,NaN
10/12/22,80,12.9,10.2,7.7,5.7,11.6,263,32,7.2,1.06,2022-12-10T08:26,2022-12-10T17:48,33669.81,25009.8,2.55,2.6,0.6,0.3,0,1,2,NaN
11/12/22,63,8.1,6.5,6,3.5,12.3,215,32,1.54,0.39,2022-12-11T08:27,2022-12-11T17:48,33628.04,0,0.5,2.45,14.9,0,0,17.5,8,NaN
12/12/22,61,14,13.1,8,6.5,19.9,223,51.1,1.21,0.36,2022-12-12T08:28,2022-12-12T17:48,33589.85,0,1,2.5,5.3,0.8,0,6.7,13,NaN
13/12/22,95,15.1,14.2,13.1,12.4,23.2,222,60.8,0.75,0.34,2022-12-13T08:29,2022-12-13T17:48,33555.29,0,0.15,2.45,18.9,4.9,0,32.5,18,NaN
14/12/22,95,13.9,13.2,10.9,9.9,10.2,205,39.2,2.77,0.54,2022-12-14T08:29,2022-12-14T17:48,33524.38,2983.4,1.65,2.45,2.2,8.9,0,12.5,13,NaN
15/12/22,80,11.7,9.4,7.5,5.9,13.5,231,37.1,4.76,0.8,2022-12-15T08:30,2022-12-15T17:48,33497.18,12701.39,2.1,2.55,0.9,0.2,0,1.1,3,NaN
16/12/22,61,10.6,9,6,4.5,5.4,106,16.9,3.81,0.57,2022-12-16T08:31,2022-12-16T17:49,33473.7,9408.41,1.15,2.5,0.1,0,0,0.1,1,NaN
17/12/22,3,12.3,11,6.8,5,4.1,21,13.3,5.63,0.8,2022-12-17T08:32,2022-12-17T17:49,33454,18632.46,2.6,2.6,0,0,0,0,0,NaN
18/12/22,45,10.9,9.2,6.2,4.7,5.5,138,19.1,6.68,0.83,2022-12-18T08:32,2022-12-18T17:49,33438.09,23539.06,2.6,2.6,0,0,0,0,0,NaN
19/12/22,45,10.8,9.2,4,1.9,5.9,68,18,7.75,0.9,2022-12-19T08:33,2022-12-19T17:50,33425.99,28523.61,2.2,2.6,0,0,0,0,0,NaN
20/12/22,61,9.5,8.7,5.9,4.3,6.2,80,16.6,2.12,0.39,2022-12-20T08:33,2022-12-20T17:50,33417.75,5941.96,1.3,2.5,1.6,0.1,0,3.4,6,NaN
21/12/22,3,14.1,11.6,7.3,5.9,14.3,240,35.6,6.37,0.94,2022-12-21T08:34,2022-12-21T17:51,33413.39,23012.88,2.6,2.6,0,0,0,0,0,NaN
22/12/22,45,14.9,13.3,9.3,8.5,11.3,235,28.8,6.89,0.96,2022-12-22T08:34,2022-12-22T17:51,33412.93,27127.46,2.55,2.55,0,0,0,0,0,NaN
23/12/22,45,13.5,12,9.5,8.6,9,211,26.3,4.95,0.75,2022-12-23T08:35,2022-12-23T17:52,33416.39,23934.48,1.3,2.55,0,0,0,0,0,NaN
24/12/22,45,12.3,11,7.5,6.5,5,144,13.7,8.25,1.02,2022-12-24T08:35,2022-12-24T17:52,33423.8,29322.59,2.6,2.6,0,0,0,0,0,NaN
25/12/22,3,13.9,12.7,7.7,6.2,9.4,138,24.1,7.62,1.02,2022-12-25T08:36,2022-12-25T17:53,33435.16,28877.52,2.6,2.6,0,0,0,0,0,NaN
26/12/22,3,15.4,13.8,4.8,2.7,4.4,44,12.2,8.58,1.14,2022-12-26T08:36,2022-12-26T17:54,33450.5,29639.45,2.55,2.6,0,0,0,0,0,NaN
27/12/22,45,14.6,12.8,2.9,0.5,5.1,30,13.7,8.96,1.15,2022-12-27T08:36,2022-12-27T17:54,33469.83,29716.89,2.5,2.5,0,0,0,0,0,NaN
28/12/22,45,13.7,11.2,1.9,-0.5,10.4,226,25.9,8.94,1.14,2022-12-28T08:37,2022-12-28T17:55,33493.16,29743.17,2.55,2.55,0,0,0,0,0,NaN
29/12/22,3,12.3,9.8,7.8,5.8,15,219,41.8,4.27,0.7,2022-12-29T08:37,2022-12-29T17:56,33520.55,11168.18,1.1,2.45,0,0,0,0,0,NaN
30/12/22,3,13.7,10.7,9.5,7.3,15.2,225,41,6.54,1.33,2022-12-30T08:37,2022-12-30T17:56,33552.29,24705.16,2.1,2.55,0,0,0,0,0,NaN
31/12/22,3,13.8,11.2,3.4,1.1,5.7,72,15.8,9.21,1.19,2022-12-31T08:37,2022-12-31T17:57,33588.36,29851,2.65,2.65,0,0,0,0,0,NaN
01/01/23,3,14.3,11.7,6.2,3.7,7.6,93,19.4,6.93,1.24,2023-01-01T08:37,2023-01-01T17:58,33628.64,29170.29,2.6,2.65,0,0,0,0,0,NaN
02/01/23,80,12.7,11.2,7.8,6.3,5.2,211,13.7,6.51,0.97,2023-01-02T08:37,2023-01-02T17:59,33673.02,26080.54,2.6,2.65,0.3,0.2,0,0.6,3,NaN
03/01/23,2,12.2,10.4,4.3,1.7,7.4,6,21.2,9.33,1.14,2023-01-03T08:37,2023-01-03T18:00,33721.38,30000.84,2.6,2.6,0,0,0,0,0,NaN
04/01/23,1,11.5,9.4,1.2,-1.6,4.5,14,13,9.4,1.1,2023-01-04T08:38,2023-01-04T18:00,33773.62,30059.48,2.7,2.7,0,0,0,0,0,NaN
05/01/23,0,11.9,9.3,1.3,-1.6,4.7,29,13.3,9.35,1.14,2023-01-05T08:37,2023-01-05T18:01,33829.62,30122.24,2.7,2.7,0,0,0,0,0,NaN
06/01/23,45,10.4,7.7,-0.2,-2.9,6.3,130,16.9,9.58,1.08,2023-01-06T08:37,2023-01-06T18:02,33889.26,30188.99,2.75,2.75,0,0,0,0,0,NaN
07/01/23,61,8,6.4,0.8,-1.7,5.4,128,15.5,3.63,0.5,2023-01-07T08:37,2023-01-07T18:03,33952.43,9240.34,1.25,2.6,0.5,0.1,0,0.6,2,NaN
08/01/23,80,13.3,10.5,8.3,6.9,26.7,235,77.8,2.17,0.58,2023-01-08T08:37,2023-01-08T18:04,34019.02,0,0.7,2.55,4,1,0,6.4,18,NaN
09/01/23,61,13.8,10.5,7.4,4.9,15.2,264,40.3,9.65,1.65,2023-01-09T08:37,2023-01-09T18:05,34088.9,30411.78,2.8,2.8,0,0,0,0,0,NaN
10/01/23,3,11.6,9.7,1.8,-0.8,6.9,164,19.1,8.95,1.06,2023-01-10T08:37,2023-01-10T18:06,34161.96,30493.09,2.85,2.85,0,0,0,0,0,NaN
11/01/23,61,10.5,9,5.2,3.4,5.6,31,18,3.92,0.56,2023-01-11T08:37,2023-01-11T18:07,34238.1,8069.35,2.35,2.8,0.5,0,0,0.5,2,NaN
12/01/23,45,10.5,8.4,0.3,-2.3,4.7,45,13.3,9.46,1.08,2023-01-12T08:36,2023-01-12T18:08,34317.19,30665.5,2.85,2.85,0,0,0,0,0,NaN
13/01/23,45,10.7,8.6,2.7,0.7,5.6,20,16.2,8.84,1.06,2023-01-13T08:36,2023-01-13T18:10,34399.12,27585.97,2.7,2.85,0,0,0,0,0,NaN
14/01/23,45,10.2,8.2,-0.6,-3.3,5.4,109,14.4,9.21,1.08,2023-01-14T08:36,2023-01-14T18:11,34483.77,27771.15,2.9,2.9,0,0,0,0,0,NaN
15/01/23,45,11.2,7.3,2.5,0.4,17.1,264,42.1,6.04,1.03,2023-01-15T08:35,2023-01-15T18:12,34571.03,18885.21,2.55,2.85,0,0,0,0,0,NaN
16/01/23,61,9.6,5.6,2.9,-0.6,23.1,235,60.8,2.13,0.74,2023-01-16T08:35,2023-01-16T18:13,34660.8,0,0.45,2.7,0,0,0,0.1,1,NaN
17/01/23,80,10.5,6.5,5,0.6,25.4,262,70.9,7.5,1.67,2023-01-17T08:35,2023-01-17T18:14,34752.96,30820.62,2.55,2.85,2.5,0.8,0,3.4,8,NaN
18/01/23,3,7.3,2.8,2.1,-2,14.8,281,44.3,8.13,1.46,2023-01-18T08:34,2023-01-18T18:15,34847.56,24669.61,2.85,2.9,0,0.4,0,0.5,4,NaN
19/01/23,61,9,4.2,1.3,-2.8,17.6,254,48.2,9.08,1.43,2023-01-19T08:34,2023-01-19T18:16,34945.64,26956.49,2.75,2.9,0.7,0,0,0.7,5,NaN
20/01/23,3,13.8,11.4,6.2,3.2,12.5,262,33.5,9.75,1.37,2023-01-20T08:33,2023-01-20T18:17,35047.26,31471.6,3,3,0,0,0,0,0,NaN
21/01/23,2,10,6.9,3.5,-1.2,13.9,43,34.6,10.5,1.58,2023-01-21T08:32,2023-01-21T18:18,35152.21,31587.03,3.05,3.05,0,0,0,0,0,NaN
22/01/23,0,9.6,4.1,-1,-4.6,15.3,12,39.6,11.45,1.78,2023-01-22T08:32,2023-01-22T18:20,35260.32,31705.75,3.1,3.1,0,0,0,0,0,NaN
23/01/23,3,9.1,4.2,-1.3,-4.9,18,3,45.7,11.21,1.6,2023-01-23T08:31,2023-01-23T18:21,35371.41,31827.57,3.05,3.05,0,0,0,0,0,NaN
24/01/23,3,6.4,2,-0.3,-4,11.7,46,32.8,7.35,1.1,2023-01-24T08:30,2023-01-24T18:22,35485.29,27854.77,3.05,3.05,0,0,0,0,0,NaN
25/01/23,2,9,5.8,-0.4,-4.2,9.4,36,27.7,11.49,1.43,2023-01-25T08:30,2023-01-25T18:23,35601.79,32064.81,3.15,3.15,0,0,0,0,0,NaN
26/01/23,3,9.6,5,-0.3,-3.4,12.2,2,33.8,10.44,1.48,2023-01-26T08:29,2023-01-26T18:24,35720.73,32143.28,2.95,3.05,0,0,0,0,0,NaN
27/01/23,2,8.8,3.4,-0.1,-3.3,20.6,4,55.8,11.19,1.67,2023-01-27T08:28,2023-01-27T18:26,35841.94,32228.25,3.15,3.15,0,0,0,0,0,NaN
28/01/23,2,10.1,5.1,-1.4,-4.4,16.3,19,44.3,11.68,1.76,2023-01-28T08:27,2023-01-28T18:27,35965.25,32308.65,3.3,3.3,0,0,0,0,0,NaN
29/01/23,1,7.2,2.9,-1.7,-5.2,12.6,44,36.7,12.13,1.47,2023-01-29T08:26,2023-01-29T18:28,36090.51,32412.63,3.3,3.3,0,0,0,0,0,NaN
30/01/23,1,8.8,5.9,-1.5,-5,8.2,23,21.6,12.37,1.42,2023-01-30T08:26,2023-01-30T18:29,36217.54,32436.64,3.45,3.45,0,0,0,0,0,NaN
31/01/23,0,11.8,8.7,-3.2,-6.5,5.1,359,11.2,12.39,1.5,2023-01-31T08:25,2023-01-31T18:30,36346.19,32440.29,3.55,3.55,0,0,0,0,0,NaN
01/02/23,0,12.6,9.4,0.4,-3.3,10.3,33,29.2,12.49,1.71,2023-02-01T08:24,2023-02-01T18:32,36476.3,32483.9,3.65,3.65,0,0,0,0,0,NaN
02/02/23,0,13.9,11.2,0.8,-2.4,7.2,25,18.4,12.64,1.72,2023-02-02T08:23,2023-02-02T18:33,36607.71,32543.22,3.5,3.5,0,0,0,0,0,NaN
03/02/23,1,15.7,12.3,-1.2,-4.3,5.4,13,16.9,13.01,1.83,2023-02-03T08:22,2023-02-03T18:34,36740.28,32589.37,3.65,3.65,0,0,0,0,0,NaN
04/02/23,0,17.3,14,-0.8,-4.1,5.1,352,14.4,13.22,1.97,2023-02-04T08:21,2023-02-04T18:35,36873.86,32703.26,3.7,3.7,0,0,0,0,0,NaN
05/02/23,0,16.7,12.8,3.8,-0.8,12.5,37,31.3,13.35,2.6,2023-02-05T08:20,2023-02-05T18:37,37008.29,32836.99,3.7,3.7,0,0,0,0,0,NaN
06/02/23,80,10.9,6.4,0.4,-3.1,18.7,50,53.6,13.34,2.03,2023-02-06T08:19,2023-02-06T18:38,37143.45,32558.24,3.8,3.8,0,0.5,0,0.6,4,NaN
07/02/23,80,9.4,6.1,1.3,-2.1,8,60,22.3,10.23,1.43,2023-02-07T08:18,2023-02-07T18:39,37279.39,31585.9,3.3,3.7,0,0.3,0,0.3,2,NaN
08/02/23,61,10.3,7.6,2.6,-1.2,11.6,47,31.7,8.02,1.22,2023-02-08T08:16,2023-02-08T18:40,37417.42,26297.52,3,3.75,0.1,0,0,0.2,2,NaN
09/02/23,3,10.7,7.7,3.5,0.9,5.6,52,16.6,11.79,1.54,2023-02-09T08:15,2023-02-09T18:41,37557.66,32976.51,2.55,3.9,0,0,0,0,0,NaN
10/02/23,3,9.3,5.6,1.3,-1.5,7.9,81,24.1,13.32,1.65,2023-02-10T08:14,2023-02-10T18:43,37699.92,33427.57,3.8,3.8,0,0,0,0,0,NaN
11/02/23,3,10.4,6.3,-0.4,-3.8,10.7,79,31.3,13.36,1.73,2023-02-11T08:13,2023-02-11T18:44,37844.06,33574.38,3.95,3.95,0,0,0,0,0,NaN
12/02/23,3,11.6,8.3,0.5,-2.7,8.1,80,23,11.34,1.6,2023-02-12T08:12,2023-02-12T18:45,37989.91,28999.76,3.05,3.95,0,0,0,0,0,NaN
13/02/23,3,11.6,8.4,1,-2,9,67,27,13.5,1.75,2023-02-13T08:11,2023-02-13T18:46,38137.32,33750.23,4.1,4.1,0,0,0,0,0,NaN
14/02/23,3,10.6,7.2,4.2,1,10.4,74,28.1,8.5,1.29,2023-02-14T08:09,2023-02-14T18:47,38286.12,12893.59,3.15,4.1,0,0,0,0,0,NaN
15/02/23,3,12.8,9.7,4.6,2,7.6,47,23,12.54,1.78,2023-02-15T08:08,2023-02-15T18:49,38436.18,32400,3.55,4.2,0,0,0,0,0,NaN
16/02/23,3,14.7,11.2,1.6,-1.3,8.4,35,25.6,15.1,2.19,2023-02-16T08:07,2023-02-16T18:50,38587.34,35285.91,4.25,4.25,0,0,0,0,0,NaN
17/02/23,0,15.7,11.6,2.4,-0.8,8.1,52,25.2,15.47,2.47,2023-02-17T08:05,2023-02-17T18:51,38739.45,35446.51,4.4,4.4,0,0,0,0,0,NaN
18/02/23,3,15.2,11.6,3.9,0.3,8.4,41,24.8,11.64,2.17,2023-02-18T08:04,2023-02-18T18:52,38892.38,30602.82,3.4,4.4,0,0,0,0,0,NaN
19/02/23,3,19,16.3,5.6,2.7,6.5,50,20.5,15.05,2.53,2023-02-19T08:03,2023-02-19T18:53,39045.98,35466.3,4.25,4.5,0,0,0,0,0,NaN
20/02/23,3,19.2,15.3,8,5.3,10,83,28.1,13.69,2.68,2023-02-20T08:01,2023-02-20T18:55,39200.11,29057.33,4.05,4.55,0,0,0,0,0,NaN
21/02/23,80,17.3,15.1,7.9,4.9,8.1,64,29.9,12.92,2.19,2023-02-21T08:00,2023-02-21T18:56,39354.65,34244.1,4.2,4.5,0,0.3,0,0.3,1,NaN
22/02/23,2,16.4,13.6,4.6,2.5,9.1,256,23.4,14.86,2.3,2023-02-22T07:58,2023-02-22T18:57,39509.46,36255.64,4.55,4.6,0,0,0,0,0,NaN
23/02/23,80,9.5,7.5,3.3,-0.3,20.2,247,55.1,11.03,1.57,2023-02-23T07:57,2023-02-23T18:58,39664.4,34308.18,4.5,4.55,0,1.8,0,2.3,8,NaN
24/02/23,1,10,6.5,-0.8,-4,7.5,259,20.2,16.89,2.11,2023-02-24T07:56,2023-02-24T18:59,39819.35,36579.48,4.6,4.6,0,0,0,0,0,NaN
25/02/23,3,8.5,5.1,-0.9,-3.9,8.6,282,24.1,11.88,1.55,2023-02-25T07:54,2023-02-25T19:00,39974.18,30227.48,4.55,4.6,0,0.3,0,0.3,3,NaN
26/02/23,3,12.1,8,-0.7,-3.6,20.7,14,47.9,13.75,2.25,2023-02-26T07:53,2023-02-26T19:02,40128.77,34213.56,4.7,4.7,0,0,0,0,0,NaN
27/02/23,3,6,0.1,0.1,-4.7,20.2,9,49,13.13,2.23,2023-02-27T07:51,2023-02-27T19:03,40283.18,36175.41,4.55,4.7,0,0,0,0,0,NaN
28/02/23,3,9.5,5.8,-2.9,-6.5,17.4,9,41.8,17.14,2.33,2023-02-28T07:50,2023-02-28T19:04,40438.66,36960.2,4.75,4.75,0,0,0,0,0,NaN
01/03/23,3,5.9,2.3,-2.4,-5.9,11.2,12,27,14.16,1.72,2023-03-01T07:48,2023-03-01T19:05,40595.37,34487.2,4.8,4.8,0,0,0,0,0,NaN
02/03/23,1,10,6.5,-2.5,-6.1,6.2,352,18,17.99,2.18,2023-03-02T07:47,2023-03-02T19:06,40753.18,37549.01,5,5,0,0,0,0,0,NaN
03/03/23,2,12.8,10,-1,-4.3,13.5,39,31,18.04,2.61,2023-03-03T07:45,2023-03-03T19:07,40911.96,37712.95,5,5,0,0,0,0,0,NaN
04/03/23,1,12.9,10.3,0.5,-2.9,7.6,37,20.9,18.36,2.51,2023-03-04T07:44,2023-03-04T19:08,41071.6,37877.52,5.1,5.1,0,0,0,0,0,NaN
05/03/23,61,10.1,6.8,0.2,-2.9,10.5,32,25.6,7.4,1.22,2023-03-05T07:42,2023-03-05T19:09,41231.98,7338.61,4.15,5.05,2.1,0,0,2.7,8,NaN
06/03/23,61,13.8,10.1,3.7,1.9,14.4,234,36.4,10.34,1.7,2023-03-06T07:41,2023-03-06T19:11,41392.99,23383.78,4.75,5.15,0.2,0,0,0.2,2,NaN
07/03/23,61,15.8,12.4,8.2,5.4,16.1,236,42.1,14.05,2.29,2023-03-07T07:39,2023-03-07T19:12,41554.51,36760.34,4.95,5.2,0.6,0,0,0.9,4,NaN
08/03/23,3,17.7,14.4,9.6,7,23.3,229,60.5,13.77,2.51,2023-03-08T07:37,2023-03-08T19:13,41716.42,33761.91,5.05,5.35,0,0,0,0,0,NaN
09/03/23,80,17.8,13.9,11.8,10,20.8,232,60.8,14.88,2.64,2023-03-09T07:36,2023-03-09T19:14,41878.62,33251.2,4.95,5.15,2.6,1.3,0,4.6,10,NaN
10/03/23,3,19.7,16.7,8.5,6.1,13.8,253,39.6,18.5,3.21,2023-03-10T07:34,2023-03-10T19:15,42041,38871.5,5.55,5.55,0,0,0,0,0,NaN
11/03/23,3,20.2,17.6,9.8,8.6,18,269,50,18.49,3.4,2023-03-11T07:32,2023-03-11T19:16,42203.44,39020.72,5.55,5.65,0,0,0,0,0,NaN
12/03/23,2,21.8,20.8,9.9,8.9,9.1,217,25.9,19.04,3.26,2023-03-12T07:31,2023-03-12T19:17,42365.82,39087.06,5.75,5.75,0,0,0,0,0,NaN
13/03/23,3,20.6,17,9.9,8.1,28.3,240,72,19.35,3.71,2023-03-13T07:29,2023-03-13T19:18,42528.06,39153.05,5.5,5.7,0,0,0,0,0,NaN
14/03/23,3,18.1,15.2,7,3.6,15.1,277,37.4,19.84,3.57,2023-03-14T07:28,2023-03-14T19:19,42690.03,39218.67,5.45,5.7,0,0,0,0,0,NaN
15/03/23,0,19.7,17.3,5,2.4,4.3,46,14.8,20.02,3.16,2023-03-15T07:26,2023-03-15T19:20,42851.63,39283.93,5.85,5.85,0,0,0,0,0,NaN
16/03/23,3,22.9,20.4,6.4,3.9,8.3,109,23.4,17.78,3.44,2023-03-16T07:24,2023-03-16T19:21,43012.75,36273.52,5.9,5.95,0,0,0,0,0,NaN
17/03/23,3,17.1,13.2,11,8.1,17.9,225,50,17.43,3.48,2023-03-17T07:23,2023-03-17T19:22,43173.28,32972.47,5.8,5.8,0,0.4,0,0.4,2,NaN
18/03/23,3,15.4,12.4,6.8,5.1,12,266,34.2,14.9,2.52,2023-03-18T07:21,2023-03-18T19:24,43333.1,39508.55,4.7,5.65,0,0.2,0,0.2,1,NaN
19/03/23,2,17.6,15.5,6.9,4.7,7.3,31,22,21.17,3.29,2023-03-19T07:20,2023-03-19T19:25,43492.29,39705.02,5.95,5.95,0,0,0,0,0,NaN
20/03/23,3,20.2,18.3,5.2,2.5,6.1,274,18.4,20.78,3.51,2023-03-20T07:18,2023-03-20T19:26,43652,39766.07,5.9,6.15,0,0,0,0,0,NaN
21/03/23,3,21,19,6.4,4,7.4,267,20.5,20.42,3.56,2023-03-21T07:16,2023-03-21T19:27,43812.36,38896.66,6.05,6.05,0,0,0,0,0,NaN
22/03/23,3,21.9,18.9,6.7,4.4,13.3,232,34.2,21.45,4.08,2023-03-22T07:15,2023-03-22T19:28,43973.28,40382.5,6,6.25,0,0,0,0,0,NaN
23/03/23,3,21.5,17.9,8.3,5.8,17.3,227,43.2,20.85,4.25,2023-03-23T07:13,2023-03-23T19:29,44134.66,36909.92,6.25,6.35,0,0,0,0,0,NaN
24/03/23,3,19.3,17.3,9.1,7.4,15.3,233,39.2,16.19,3.05,2023-03-24T07:11,2023-03-24T19:30,44296.39,38643.21,5.55,6.3,0,0,0,0,0,NaN
25/03/23,45,20.4,17.2,7.6,6.7,12.8,230,33.5,21.91,3.86,2023-03-25T07:10,2023-03-25T19:31,44458.39,39953.11,6.45,6.45,0,0,0,0,0,NaN
26/03/23,3,20.4,16.1,10.1,8,18.4,285,50,22.63,4.46,2023-03-26T07:08,2023-03-26T19:32,44620.54,39877.32,6.45,6.45,0,0,0,0,0,NaN
27/03/23,0,19.5,17.6,6.7,3.7,6.4,24,20.2,23.01,3.7,2023-03-27T07:06,2023-03-27T19:33,44782.75,41224.09,6.4,6.4,0,0,0,0,0,NaN
28/03/23,3,23.3,20.5,6.5,3,5.7,48,17.6,22.84,4.12,2023-03-28T07:05,2023-03-28T19:34,44944.93,41322.91,6.5,6.5,0,0,0,0,0,NaN
29/03/23,3,25.3,23,8.9,6.2,11.7,228,30.6,22.87,4.61,2023-03-29T07:03,2023-03-29T19:35,45106.95,41382.89,6.55,6.6,0,0,0,0,0,NaN
30/03/23,3,22.5,19.4,11.8,9.7,17.1,234,45.7,21.66,4.59,2023-03-30T07:01,2023-03-30T19:36,45268.73,41516.49,6.25,6.55,0,0,0,0,0,NaN
31/03/23,3,20.1,17.3,11.5,9.4,17.3,241,47.2,18.69,3.75,2023-03-31T07:00,2023-03-31T19:37,45430.17,35518.47,6.35,6.6,0,0,0,0,0,NaN
01/04/23,3,18.1,14.2,10.4,7.1,18.9,288,50,18.6,3.85,2023-04-01T06:58,2023-04-01T19:38,45591.15,41838.85,5.5,6.5,0,0,0,0,0,NaN
02/04/23,1,17.7,14.8,5.4,2.4,14.8,21,40.7,24.33,4.25,2023-04-02T06:57,2023-04-02T19:39,45751.58,42081.64,6.7,6.7,0,0,0,0,0,NaN
03/04/23,3,19.4,17.1,4.3,1.3,6.4,31,20.9,23.62,3.9,2023-04-03T06:55,2023-04-03T19:40,45911.34,41871.68,6.4,6.8,0,0,0,0,0,NaN
04/04/23,3,20.4,16.1,7.7,3.8,15.5,47,41.4,25.45,5.3,2023-04-04T06:53,2023-04-04T19:41,46070.34,42529.59,6.6,6.6,0,0,0,0,0,NaN
05/04/23,1,21.3,18.1,5.2,1,11.8,46,32.8,25.65,4.73,2023-04-05T06:52,2023-04-05T19:42,46228.45,42642.62,6.6,6.6,0,0,0,0,0,NaN
06/04/23,3,22.9,21,8.3,4.4,7.8,47,19.8,25.1,4.73,2023-04-06T06:50,2023-04-06T19:43,46385.57,42839.59,6.7,6.7,0,0,0,0,0,NaN
07/04/23,1,24.1,21.2,8.3,4.8,10.5,143,29.9,25.25,5.09,2023-04-07T06:49,2023-04-07T19:44,46541.59,42950.86,6.75,6.75,0,0,0,0,0,NaN
08/04/23,2,25.6,24.5,8.6,5.4,7.4,330,20.5,25.13,4.82,2023-04-08T06:47,2023-04-08T19:45,46696.56,43059.45,6.85,6.85,0,0,0,0,0,NaN
09/04/23,3,26.5,24.5,10.1,7.8,12.6,256,33.8,24.14,4.94,2023-04-09T06:45,2023-04-09T19:46,46851.57,42682.96,6.85,6.9,0,0,0,0,0,NaN
10/04/23,3,27,24.6,11.2,9.3,16.8,300,41.8,24.3,5.22,2023-04-10T06:44,2023-04-10T19:47,47006.77,43172.07,6.95,7,0,0,0,0,0,NaN
11/04/23,1,25.9,23.1,10.8,8.5,14.8,249,35.6,25.33,5.5,2023-04-11T06:42,2023-04-11T19:48,47162.04,43582.02,7.15,7.15,0,0,0,0,0,NaN
12/04/23,61,21,17.8,11.4,7.9,16.7,278,46.1,19.61,4.37,2023-04-12T06:41,2023-04-12T19:50,47317.29,38455.75,6.1,7.1,0.1,0.1,0,0.2,2,NaN
13/04/23,3,16.5,13.3,6.8,3.6,15.3,296,43.2,26.09,4.53,2023-04-13T06:39,2023-04-13T19:51,47472.41,43471.45,6.9,7,0,0,0,0,0,NaN
14/04/23,3,19.8,16.1,9.5,6.3,19.8,281,58,16.5,3.85,2023-04-14T06:38,2023-04-14T19:52,47627.31,30821.04,5.4,6.85,0,0,0,0,0,NaN
15/04/23,2,23.1,21.6,10.1,8.1,16.7,355,45,25.46,4.98,2023-04-15T06:36,2023-04-15T19:53,47781.87,44465.55,7.1,7.1,0,0,0,0,0,NaN
16/04/23,1,24.2,22.8,10.1,8,14,32,38.9,26.4,5.4,2023-04-16T06:35,2023-04-16T19:54,47935.98,44717.85,7.25,7.25,0,0,0,0,0,NaN
17/04/23,0,24.7,23.5,8.8,5,10.7,39,28.4,26.83,5.47,2023-04-17T06:33,2023-04-17T19:55,48089.55,44865.79,7.35,7.35,0,0,0,0,0,NaN
18/04/23,3,22.8,21.3,8.1,4.4,14,54,34.6,27.12,5.1,2023-04-18T06:32,2023-04-18T19:56,48242.45,44974.17,7.4,7.4,0,0,0,0,0,NaN
19/04/23,3,24.2,22.8,10.2,7.9,13,119,32.8,26.54,4.89,2023-04-19T06:30,2023-04-19T19:57,48394.56,44280.96,7.25,7.35,0,0,0,0,0,NaN
20/04/23,3,26.6,25.3,12.3,9.8,13,242,34.2,25.92,5.35,2023-04-20T06:29,2023-04-20T19:58,48545.79,43915.15,7.25,7.25,0,0,0,0,0,NaN
21/04/23,3,25,21.9,12.6,10.2,18.2,226,50,22.38,5.14,2023-04-21T06:27,2023-04-21T19:59,48695.99,38914.11,7.15,7.25,0,0,0,0,0,NaN
22/04/23,63,20.9,18.1,12.3,11.2,13.5,254,38.2,21.72,4.21,2023-04-22T06:26,2023-04-22T20:00,48845.06,38594.8,7.3,7.3,5.7,0,0,5.7,6,NaN
23/04/23,3,23.6,21.3,9.5,7.9,14.2,261,38.5,25.4,4.93,2023-04-23T06:24,2023-04-23T20:01,48992.88,45309.89,7.4,7.4,0,0,0,0,0,NaN
24/04/23,3,25.4,23.5,10.4,9.2,11.2,259,28.4,26.26,5.08,2023-04-24T06:23,2023-04-24T20:02,49139.3,45367.69,7.3,7.4,0,0,0,0,0,NaN
25/04/23,3,28.4,26.7,13,11.9,12.4,282,33.5,26.24,5.51,2023-04-25T06:21,2023-04-25T20:03,49284.21,45386.3,7.4,7.5,0,0,0,0,0,NaN
26/04/23,3,29.2,26.5,13,11.8,13,244,33.8,27.6,5.95,2023-04-26T06:20,2023-04-26T20:04,49427.48,45604.68,7.55,7.55,0,0,0,0,0,NaN
27/04/23,3,30.5,27.8,14.5,12.8,9.9,204,26.3,23.34,5.25,2023-04-27T06:19,2023-04-27T20:05,49568.96,42663.19,7.35,7.6,0,0,0,0,0,NaN
28/04/23,3,31.4,29.5,16.2,14.6,14,255,36.7,23.12,5.76,2023-04-28T06:17,2023-04-28T20:06,49708.69,34871.92,7.2,7.65,0,0,0,0,0,NaN
29/04/23,3,26.1,23.7,17.2,16,15.7,278,41,16.91,4.22,2023-04-29T06:16,2023-04-29T20:07,49847.71,32755.14,6.8,7.55,0,0,0,0,0,NaN
30/04/23,3,24.4,23.7,14.2,12.8,12,33,33.8,21.52,4.59,2023-04-30T06:15,2023-04-30T20:08,49986.15,29250.57,6.1,7.55,0,0,0,0,0,NaN
01/05/23,3,26.7,26.6,11.8,9.6,12.3,39,32,27.71,5.59,2023-05-01T06:14,2023-05-01T20:09,50123.88,46344.66,7.45,7.6,0,0,0,0,0,NaN
02/05/23,3,28.5,27.8,14.1,10.8,9.5,53,24.5,26.23,5.57,2023-05-02T06:12,2023-05-02T20:10,50260.81,38342.34,7.5,7.75,0,0,0,0,0,NaN
03/05/23,3,29,26.3,15.4,13,14.7,156,42.8,24.02,5.94,2023-05-03T06:11,2023-05-03T20:11,50396.81,42527.73,7.1,7.7,0,0,0,0,0,NaN
04/05/23,3,24.8,22,14.8,13.3,15.5,232,43.9,28.72,6.43,2023-05-04T06:10,2023-05-04T20:12,50531.77,46268.17,7.15,7.65,0,0,0,0,0,NaN
05/05/23,3,26.6,24.4,12.4,10.6,9.9,232,30.2,27.8,5.56,2023-05-05T06:09,2023-05-05T20:13,50665.56,47054.68,7.1,7.7,0,0,0,0,0,NaN
06/05/23,3,27.6,25.3,13.1,11.4,13.8,248,39.6,28.35,6.11,2023-05-06T06:08,2023-05-06T20:14,50798.06,46207,7.05,7.7,0,0,0,0,0,NaN
07/05/23,3,27.1,26.1,15.5,13.7,11.2,353,31,24.66,5.34,2023-05-07T06:06,2023-05-07T20:15,50929.16,45153.38,7.65,7.65,0,0,0,0,0,NaN
08/05/23,3,29.4,28.2,14.4,12.5,12.7,336,35.3,27.99,6.2,2023-05-08T06:05,2023-05-08T20:16,51058.72,47410.07,7.8,7.8,0,0,0,0,0,NaN
09/05/23,3,27.2,26.4,17.5,16.7,18.3,318,49.7,24.86,5.66,2023-05-09T06:04,2023-05-09T20:17,51186.61,47372.4,7.65,7.9,0,0,0,0,0,NaN
10/05/23,3,24.2,22.9,13,10.9,14.3,39,38.5,26.79,5.54,2023-05-10T06:03,2023-05-10T20:18,51312.7,47918.43,7.5,7.9,0,0,0,0,0,NaN
11/05/23,3,21.7,20,9.9,6.3,17.1,33,46.1,28.37,5.76,2023-05-11T06:02,2023-05-11T20:19,51436.85,47763.32,7.85,7.85,0,0,0,0,0,NaN
12/05/23,3,17.6,15.7,10.6,7.7,15.3,20,41.8,23.1,4.68,2023-05-12T06:01,2023-05-12T20:20,51558.93,45310.38,7.5,7.65,0,0.3,0,0.3,2,NaN
13/05/23,3,19.9,17.6,7.5,5.1,12.2,24,37.8,25.34,4.79,2023-05-13T06:00,2023-05-13T20:21,51678.79,48259.38,7.45,7.65,0,0,0,0,0,NaN
14/05/23,3,19.9,18.5,9.6,7.4,14,17,39.2,23.55,4.58,2023-05-14T05:59,2023-05-14T20:22,51796.3,48368.54,6.55,7.7,0,0,0,0,0,NaN
15/05/23,3,21,18.7,9.5,7.5,15.9,11,45,23.62,4.78,2023-05-15T05:58,2023-05-15T20:23,51911.31,46519.05,7.75,7.75,0,0,0,0,0,NaN
16/05/23,3,22.2,20.8,9.5,6.6,14.4,32,37.1,27.77,5.59,2023-05-16T05:57,2023-05-16T20:24,52023.66,47881.3,7.25,7.85,0,0,0,0,0,NaN
17/05/23,3,23.9,20.6,7.7,3.6,18.4,53,49.3,30.25,6.78,2023-05-17T05:56,2023-05-17T20:25,52133.21,47502.5,7.2,7.8,0,0,0,0,0,NaN
18/05/23,3,22,19.4,9,5.1,17.7,43,48.6,29.25,6.29,2023-05-18T05:55,2023-05-18T20:26,52239.96,47533.02,7.8,7.8,0,0,0,0,0,NaN
19/05/23,3,21,18.8,9.2,6.1,15.3,33,45.4,25.68,5.49,2023-05-19T05:54,2023-05-19T20:27,52344.75,48876.64,7.8,7.8,0,0,0,0,0,NaN
20/05/23,3,19.8,17,8.8,5.9,12.1,36,35.6,23.94,4.7,2023-05-20T05:54,2023-05-20T20:28,52447.7,47950.02,5.65,7.65,0,0,0,0,0,NaN
21/05/23,3,20.8,19.4,11.5,8.1,15.9,51,43.6,21.82,4.74,2023-05-21T05:53,2023-05-21T20:29,52548.7,40909.95,6.7,7.75,0,0.3,0,0.3,3,NaN
22/05/23,80,22.9,21.2,13,12.4,12.6,67,40.3,24.26,4.85,2023-05-22T05:52,2023-05-22T20:30,52647.64,39679.24,7.05,7.85,0,1.1,0,1.2,6,NaN
23/05/23,95,22.3,20.7,14.9,13.2,16,57,51.5,18.48,3.81,2023-05-23T05:51,2023-05-23T20:31,52744.43,32862.95,6.9,7.85,0.3,5.5,0,5.7,10,NaN
24/05/23,80,23,22.4,13.7,12.6,10.2,56,36.7,22.22,4.12,2023-05-24T05:51,2023-05-24T20:31,52838.95,42708.7,7.9,7.9,0.1,5.4,0,5.5,14,NaN
25/05/23,80,23.7,23.4,13.1,12.9,15.1,59,45,20.48,3.91,2023-05-25T05:50,2023-05-25T20:32,52931.09,41071.74,7.65,8,0.4,3,0,3.4,6,NaN
26/05/23,95,19.7,19.6,12.3,10.6,14.5,84,40.7,8.08,1.74,2023-05-26T05:49,2023-05-26T20:33,53020.75,5180.92,6.35,7.9,59.7,10.3,0,69.8,22,NaN
27/05/23,95,21.3,20,14,13,10.9,85,33.8,17.05,3.25,2023-05-27T05:49,2023-05-27T20:34,53107.82,32217.45,7.75,7.95,0.6,3.6,0,4.2,8,NaN
28/05/23,95,20.1,19.5,13.6,13.1,8.4,138,28.4,15.29,2.92,2023-05-28T05:48,2023-05-28T20:35,53192.19,32840.37,7.25,7.9,2.1,5.1,0,7.1,11,NaN
29/05/23,95,22.5,22.1,13.6,14,9.4,153,34.6,21.44,3.86,2023-05-29T05:48,2023-05-29T20:36,53273.73,36755.45,7.4,7.95,0,3.4,0,3.4,5,NaN
30/05/23,80,21.9,22.3,13.3,13.8,6.5,204,25.6,19.88,3.6,2023-05-30T05:47,2023-05-30T20:36,53352.36,34439.4,7.95,7.95,0,3.8,0,3.8,11,NaN
31/05/23,80,23.7,23.8,13.7,14.3,9.5,199,28.1,24.39,4.57,2023-05-31T05:47,2023-05-31T20:37,53427.93,45154.85,7.8,7.95,0,3.1,0,3.1,12,NaN
01/06/23,95,23.6,24.4,14.4,14.7,9.2,69,27.4,19.19,3.57,2023-06-01T05:46,2023-06-01T20:38,53500.36,32785.85,7.45,8,0,8.7,0,8.7,16,NaN
02/06/23,95,23.3,23.7,14.3,14.1,7.4,80,18.7,20.58,3.82,2023-06-02T05:46,2023-06-02T20:39,53569.52,40747.37,8.05,8.05,0,9.8,0,9.8,17,NaN
03/06/23,80,25.3,25,13.7,13.9,10.4,87,25.9,25.03,4.82,2023-06-03T05:45,2023-06-03T20:39,53635.3,48045.32,8.05,8.05,0,1,0,1,3,NaN
04/06/23,80,25.8,26.4,15,15.2,9.4,89,45.4,22.92,4.4,2023-06-04T05:45,2023-06-04T20:40,53697.57,38326.64,8.05,8.05,0.1,2.3,0,2.3,5,NaN
05/06/23,80,26.5,27.4,15.6,15.7,8.9,97,31.7,23.06,4.51,2023-06-05T05:45,2023-06-05T20:41,53756.24,41582.69,8.1,8.1,0.1,1.6,0,1.8,2,NaN
06/06/23,3,28.7,28.3,15.4,15.9,8.5,112,22.3,26.76,5.44,2023-06-06T05:44,2023-06-06T20:41,53811.18,49498.06,7.2,8.2,0,0,0,0,0,NaN
07/06/23,80,22.9,21.1,16.6,17.1,12.8,134,32.4,3.42,1.42,2023-06-07T05:44,2023-06-07T20:42,53862.36,0,1.25,7.9,6.8,1,0,7.7,9,NaN
08/06/23,80,20.4,20.3,16.4,17.2,10.3,159,34.6,10.96,2.11,2023-06-08T05:44,2023-06-08T20:43,53910.2,8617.82,6.1,8.15,3.2,4.2,0,7.6,14,NaN
09/06/23,80,23.9,22.6,15.5,15.8,13.5,228,39.6,21.74,4.36,2023-06-09T05:44,2023-06-09T20:43,53954.77,45180.19,6.55,8,0,2.4,0,2.4,10,NaN
10/06/23,3,26.8,26.4,16.4,17.4,10.5,223,29.5,23.55,4.91,2023-06-10T05:44,2023-06-10T20:44,53996.02,41448,8.15,8.15,0,0,0,0,0,NaN
11/06/23,3,27.6,26.6,18.1,18.5,14.5,248,43.2,25.32,5.55,2023-06-11T05:44,2023-06-11T20:44,54033.94,46174.1,8.15,8.15,0,0.2,0,0.2,2,NaN
12/06/23,80,27.9,27.2,16.8,16.7,12.4,291,40,23.4,5.13,2023-06-12T05:43,2023-06-12T20:45,54068.48,46800,8.05,8.05,0,1.2,0,1.2,9,NaN
13/06/23,80,23.9,23.8,16,16,11.4,346,42.8,22.73,4.44,2023-06-13T05:43,2023-06-13T20:45,54099.62,44035.88,7.85,8.05,0,2.5,0,2.5,12,NaN
14/06/23,3,27.2,26.5,15.3,15.1,8.4,14,22.7,24.32,4.98,2023-06-14T05:43,2023-06-14T20:46,54127.32,49550.8,7.75,8.25,0,0,0,0,0,NaN
15/06/23,3,30.9,30.9,17.5,16.9,9.3,11,23,28.81,6.08,2023-06-15T05:43,2023-06-15T20:46,54151.57,49564.65,8.25,8.25,0,0,0,0,0,NaN
16/06/23,3,32.7,32.8,20.2,18.9,8.4,90,23.8,29.35,6.68,2023-06-16T05:43,2023-06-16T20:46,54172.32,49644.09,8.3,8.3,0,0,0,0,0,NaN
17/06/23,80,33.6,32.9,20.7,21.7,14.6,223,44.6,22.42,5.81,2023-06-17T05:44,2023-06-17T20:47,54189.57,42884.49,8.1,8.25,0,2,0,2,8,NaN
18/06/23,80,30.5,30.8,19.9,19,12.3,159,47.9,25.23,5.9,2023-06-18T05:44,2023-06-18T20:47,54203.28,39696.99,7.9,8.2,0,2.4,0,2.4,13,NaN
19/06/23,80,29.4,28.6,19.2,19.1,13.2,110,47.5,20.47,4.98,2023-06-19T05:44,2023-06-19T20:47,54213.43,31113.51,8,8.15,0,1.2,0,1.2,10,NaN
20/06/23,3,26.7,25.7,19.2,19.1,16,230,41,23.75,5.48,2023-06-20T05:44,2023-06-20T20:48,54220.02,48510.23,7.2,8.15,0,0,0,0,0,NaN
21/06/23,80,27.9,27.2,18.5,18.9,19.5,200,45.7,22.92,4.76,2023-06-21T05:44,2023-06-21T20:48,54223,35070.93,6.6,8.2,0,0.9,0,0.9,4,NaN
22/06/23,2,28.8,29.5,16.1,17.5,5.8,165,16.6,26.39,5.16,2023-06-22T05:44,2023-06-22T20:48,54222.37,49488.78,8.25,8.25,0,0,0,0,0,NaN
23/06/23,2,31.9,33.4,19,18.5,11.8,61,25.9,29.77,6.3,2023-06-23T05:45,2023-06-23T20:48,54218.12,49565.47,8.3,8.3,0,0,0,0,0,NaN
24/06/23,1,34.1,35.6,20.8,20.8,6.9,125,20.9,30.67,6.73,2023-06-24T05:45,2023-06-24T20:48,54210.23,49735.27,8.35,8.35,0,0,0,0,0,NaN
25/06/23,3,36.8,37.7,21.4,22.7,12.9,308,32.8,29.44,7.06,2023-06-25T05:45,2023-06-25T20:49,54198.69,49440.42,8.3,8.3,0,0.2,0,0.2,2,NaN
26/06/23,3,37,37.6,23.8,24.4,9,21,25.6,29.52,6.96,2023-06-26T05:46,2023-06-26T20:49,54183.49,49606.34,8.25,8.25,0,0,0,0,0,NaN
27/06/23,2,35.5,37.1,22.5,23.3,9.4,43,27.4,30.64,7.14,2023-06-27T05:46,2023-06-27T20:49,54164.6,49774.52,8.25,8.25,0,0,0,0,0,NaN
28/06/23,2,35,36.5,22.3,23.2,13.1,2,31.7,29.81,7.41,2023-06-28T05:46,2023-06-28T20:49,54141.8,49659.37,8.25,8.25,0,0,0,0,0,NaN
29/06/23,3,35.3,33.9,20.9,20.6,18.8,324,51.1,30.08,7.88,2023-06-29T05:47,2023-06-29T20:49,54115.11,49542.35,8.3,8.3,0,0,0,0,0,NaN
30/06/23,1,29,28.5,16.6,14.7,19.3,41,46.4,30.76,7.21,2023-06-30T05:47,2023-06-30T20:49,54084.62,49704.58,8.15,8.15,0,0,0,0,0,NaN
01/07/23,2,32,33.1,17.6,16.5,10.8,42,28.8,30.13,6.64,2023-07-01T05:48,2023-07-01T20:48,54050.39,49397.51,8.25,8.25,0,0,0,0,0,NaN
02/07/23,80,33.8,34.9,20.6,19.5,15.5,20,45,26.56,6.63,2023-07-02T05:48,2023-07-02T20:48,54012.53,45728.53,8.25,8.25,0,0.6,0,0.6,5,NaN
03/07/23,3,35.8,35.4,22,22,16.3,331,50,25.7,6.78,2023-07-03T05:49,2023-07-03T20:48,53971.09,47559.15,8.25,8.25,0,0.2,0,0.2,2,NaN
04/07/23,1,33.8,33.1,20.6,22.8,12.4,312,35.3,30.45,7.15,2023-07-04T05:49,2023-07-04T20:48,53926.17,49584.96,8.3,8.3,0,0,0,0,0,NaN
05/07/23,3,32.7,31.9,18.6,17.3,12.9,238,38.5,28.09,6.43,2023-07-05T05:50,2023-07-05T20:48,53877.85,49185.29,8.05,8.3,0,0,0,0,0,NaN
06/07/23,3,33.2,32.5,21.4,22,13.2,189,36.7,29.82,6.9,2023-07-06T05:50,2023-07-06T20:48,53826.21,45496.48,8.25,8.25,0,0,0,0,0,NaN
07/07/23,3,33.8,32.8,20.7,21.9,15,177,41,27.67,6.88,2023-07-07T05:51,2023-07-07T20:47,53771.33,49106.48,8.1,8.1,0,0,0,0,0,NaN
08/07/23,1,32.1,31.5,19.9,18.9,13.2,231,36,30.78,7.13,2023-07-08T05:52,2023-07-08T20:47,53713.3,49439.61,8.25,8.25,0,0,0,0,0,NaN
09/07/23,3,34,32.8,20.1,19.1,10.5,237,30.6,28.5,6.4,2023-07-09T05:52,2023-07-09T20:47,53652.21,49079.97,8.15,8.2,0,0,0,0,0,NaN
10/07/23,0,38.3,38.2,20.1,18.8,9.2,314,28.1,30.39,7.08,2023-07-10T05:53,2023-07-10T20:46,53588.14,49273.02,8.25,8.25,0,0,0,0,0,NaN
11/07/23,1,38,36.3,24.1,23.3,19.1,242,49.3,30.58,8.34,2023-07-11T05:54,2023-07-11T20:46,53521.18,49232.07,8.3,8.3,0,0,0,0,0,NaN
12/07/23,3,33.2,31.6,21.9,20.7,11.9,255,33.5,22.14,5.72,2023-07-12T05:55,2023-07-12T20:45,53451.4,42333.73,6.45,8.2,0,0,0,0,0,NaN
13/07/23,2,34.3,34.5,20.1,19,8.2,263,24.1,29.91,6.76,2023-07-13T05:55,2023-07-13T20:45,53378.91,49066.29,8.2,8.2,0,0,0,0,0,NaN
14/07/23,0,36,34.7,21.1,21.2,17.6,234,45.4,30.16,7.71,2023-07-14T05:56,2023-07-14T20:44,53303.77,49103.09,8.15,8.15,0,0,0,0,0,NaN
15/07/23,0,31.8,30.2,21.7,20.7,17.8,232,46.8,30.13,7.66,2023-07-15T05:57,2023-07-15T20:44,53226.09,48904.46,8.2,8.2,0,0,0,0,0,NaN
16/07/23,3,33.4,33,18,17.2,11.1,238,33.5,30.28,6.78,2023-07-16T05:57,2023-07-16T20:43,53145.93,48937.68,8.2,8.2,0,0,0,0,0,NaN
17/07/23,3,38.3,37.8,19.8,17.5,8.2,63,25.2,25.74,6.13,2023-07-17T05:58,2023-07-17T20:43,53063.27,48711.44,8.05,8.25,0,0,0,0,0,NaN
18/07/23,3,38.4,37.1,23.6,24.4,15.7,240,43.9,26.53,7.51,2023-07-18T05:59,2023-07-18T20:42,52977.37,45008.83,8.2,8.2,0,0,0,0,0,NaN
19/07/23,3,37.4,35.5,26.4,25.7,21.7,233,57.6,29.84,8.6,2023-07-19T06:00,2023-07-19T20:41,52888.21,48034.68,8.2,8.2,0,0,0,0,0,NaN
20/07/23,2,34.6,31.5,22.5,21.2,18.7,233,51.1,30.51,8.15,2023-07-20T06:01,2023-07-20T20:41,52795.92,48585.52,8.15,8.15,0,0,0,0,0,NaN
21/07/23,3,31.3,30.8,20.7,20,13.8,237,37.8,26.91,6.54,2023-07-21T06:02,2023-07-21T20:40,52700.66,48631.62,7.6,8.1,0,0,0,0,0,NaN
22/07/23,3,31.8,31.1,18.7,17.5,12.5,17,31.3,24.96,6.03,2023-07-22T06:02,2023-07-22T20:39,52602.54,47211.64,5.85,8,0,0,0,0,0,NaN
23/07/23,2,35.2,33.4,19.2,17.6,14.3,236,39.6,29.98,7.31,2023-07-23T06:03,2023-07-23T20:38,52501.73,48408.14,8.05,8.05,0,0,0,0,0,NaN
24/07/23,3,31.7,31.2,20.7,19.3,16.4,265,44.3,27.89,7.08,2023-07-24T06:04,2023-07-24T20:37,52398.36,47875.45,8,8,0,0,0,0,0,NaN
25/07/23,1,31.5,30,18.3,17.4,13.4,305,36,29.87,6.67,2023-07-25T06:05,2023-07-25T20:36,52292.57,48205.37,8,8,0,0,0,0,0,NaN
26/07/23,0,33,33.2,17.9,16.2,10.9,49,28.4,29.75,6.49,2023-07-26T06:06,2023-07-26T20:36,52184.47,47958.62,8.1,8.1,0,0,0,0,0,NaN
27/07/23,0,33.1,32,21.4,21.4,16.6,221,45,29.47,7.42,2023-07-27T06:07,2023-07-27T20:35,52074.21,47720.99,7.95,7.95,0,0,0,0,0,NaN
28/07/23,3,33.4,32.3,20.4,19.8,13.3,230,36.7,29.1,6.96,2023-07-28T06:08,2023-07-28T20:34,51961.93,47813.56,7.95,7.95,0,0,0,0,0,NaN
29/07/23,1,35.2,33.9,20.2,19.6,14.6,242,41,29.03,7.28,2023-07-29T06:09,2023-07-29T20:33,51847.74,47691.36,8,8,0,0,0,0,0,NaN
30/07/23,1,36.2,35,21.5,21.1,12.5,245,36.7,28.9,7.21,2023-07-30T06:10,2023-07-30T20:32,51731.77,47573.71,8,8,0,0,0,0,0,NaN
31/07/23,1,36.3,36.7,22.9,22.9,10,1,26.3,28.8,7.17,2023-07-31T06:11,2023-07-31T20:31,51614.14,47460.78,8,8,0,0,0,0,0,NaN
01/08/23,0,35.7,35.7,21.8,20.6,7,279,20.2,29.03,6.36,2023-08-01T06:12,2023-08-01T20:30,51494.98,47448.27,8,8,0,0,0,0,0,NaN
02/08/23,2,35.2,34.6,22.2,22.1,15.3,291,41,28.45,7.32,2023-08-02T06:12,2023-08-02T20:29,51374.41,47342.36,7.9,7.9,0,0,0,0,0,NaN
03/08/23,2,32.2,32.8,21.5,20,12,347,32.8,28.1,6.32,2023-08-03T06:13,2023-08-03T20:28,51252.54,47118.31,7.9,7.9,0,0,0,0,0,NaN
04/08/23,2,28.4,27,15.8,12.8,17.8,34,44.6,29.02,7.12,2023-08-04T06:14,2023-08-04T20:26,51129.49,47221.98,7.9,7.9,0,0,0,0,0,NaN
05/08/23,3,33.1,32.1,14.9,13.3,12.9,56,36,28.56,6.27,2023-08-05T06:15,2023-08-05T20:25,51005.37,46896.52,7.9,7.9,0,0,0,0,0,NaN
06/08/23,0,35.8,35.8,19.5,16.8,16.8,24,40.7,28.26,7.46,2023-08-06T06:16,2023-08-06T20:24,50880.12,46827.15,7.9,7.9,0,0,0,0,0,NaN
07/08/23,0,35.8,35.6,18.3,14.2,16.5,53,42.1,28.34,7.15,2023-08-07T06:17,2023-08-07T20:23,50752.79,46679.15,7.9,7.9,0,0,0,0,0,NaN
08/08/23,1,38.7,38.3,22.6,20.6,11.8,159,31.3,27.54,7.1,2023-08-08T06:18,2023-08-08T20:22,50623.27,46608.01,7.9,7.9,0,0,0,0,0,NaN
09/08/23,3,39.2,38.7,23.8,23.6,14.8,241,39.6,23.32,6.7,2023-08-09T06:19,2023-08-09T20:21,50491.73,44188.43,7.85,7.85,0,0,0,0,0,NaN
10/08/23,1,37.7,36.8,24.4,23.7,13.2,261,32.4,28.25,7.21,2023-08-10T06:20,2023-08-10T20:19,50358.28,46393.43,7.8,7.8,0,0,0,0,0,NaN
11/08/23,1,38.2,37.8,22.7,20.8,8,48,23.4,27.98,6.97,2023-08-11T06:21,2023-08-11T20:18,50223.07,46318.8,7.75,7.75,0,0,0,0,0,NaN
12/08/23,1,37.2,37.7,23.8,22.8,9.5,246,27,27.09,6.54,2023-08-12T06:22,2023-08-12T20:17,50086.25,46185.25,7.7,7.7,0,0,0,0,0,NaN
13/08/23,2,36.4,36.7,23.1,23.2,15.3,207,38.5,26.85,7.22,2023-08-13T06:23,2023-08-13T20:15,49947.92,46110.34,7.7,7.7,0,0,0,0,0,NaN
14/08/23,3,34.4,32.8,22.3,21.6,12.7,209,33.8,27.54,6.83,2023-08-14T06:24,2023-08-14T20:14,49808.23,46033.33,7.65,7.65,0,0,0,0,0,NaN
15/08/23,3,35.1,33.3,20.9,18.7,10.9,228,31,26.4,6.57,2023-08-15T06:25,2023-08-15T20:13,49667.29,43131.25,7.6,7.6,0,0,0,0,0,NaN
16/08/23,3,34.6,33.3,21.8,20,11.8,216,33.5,27.37,6.5,2023-08-16T06:26,2023-08-16T20:11,49525.23,45834.64,7.55,7.55,0,0,0,0,0,NaN
17/08/23,3,34.9,33.7,20.8,19.8,12.2,237,34.6,26.89,6.55,2023-08-17T06:27,2023-08-17T20:10,49382.18,45752.65,7.6,7.6,0,0,0,0,0,NaN
18/08/23,3,33.4,31.1,20.7,19.4,15.5,226,42.8,23.18,6.41,2023-08-18T06:28,2023-08-18T20:08,49238.23,45670.72,7.1,7.6,0,0,0,0,0,NaN
19/08/23,3,36,35.5,19.9,18.3,10.2,241,28.4,25.86,6.17,2023-08-19T06:29,2023-08-19T20:07,49093.52,45587.95,7.55,7.55,0,0,0,0,0,NaN
20/08/23,2,38.2,37.3,22.6,21.8,8.2,224,24.1,26.29,6.04,2023-08-20T06:30,2023-08-20T20:06,48948.16,45504.39,7.45,7.45,0,0,0,0,0,NaN
21/08/23,2,39.1,39.5,23.6,23.1,7.8,103,23.8,25.77,6.35,2023-08-21T06:31,2023-08-21T20:04,48802.25,45420.15,7.45,7.45,0,0,0,0,0,NaN
22/08/23,1,39.1,38.6,24.8,23.6,9.1,114,22.7,25.82,6.69,2023-08-22T06:32,2023-08-22T20:03,48655.91,45335.29,7.45,7.45,0,0,0,0,0,NaN
23/08/23,1,38.5,37.9,24.3,23.5,11.3,126,29.9,25.8,6.98,2023-08-23T06:33,2023-08-23T20:01,48509.23,45244.19,7.4,7.4,0,0,0,0,0,NaN
24/08/23,3,38.8,37.7,23,22,9.9,173,27.4,25.6,6.79,2023-08-24T06:34,2023-08-24T20:00,48362.34,45103.19,7.35,7.35,0,0,0,0,0,NaN
25/08/23,3,37.4,35.2,22.7,20.7,18.4,253,52.6,23.19,7.08,2023-08-25T06:35,2023-08-25T19:58,48215.32,43536.77,7.4,7.4,0,0,0,0,0,NaN
26/08/23,3,32.2,28.8,22.9,20.2,28,233,71.6,19.48,6.85,2023-08-26T06:36,2023-08-26T19:57,48068.11,36370.65,6.25,7.3,0,0,0,0,0,NaN
27/08/23,3,23.9,20.6,16.6,13.1,20,7,50.8,23.37,5.77,2023-08-27T06:37,2023-08-27T19:55,47919.71,44676.61,7.15,7.15,0,0,0,0,0,NaN
28/08/23,3,27.4,26.5,14.2,13.3,9.8,323,26.3,25.08,4.99,2023-08-28T06:38,2023-08-28T19:54,47769.97,43840.96,7.2,7.2,0,0,0,0,0,NaN
29/08/23,3,27,26.2,16.3,15.3,10.1,17,29.5,20.38,4.54,2023-08-29T06:39,2023-08-29T19:52,47619.04,43324.49,7.1,7.1,0,0,0,0,0,NaN
30/08/23,3,27.7,26.9,15.3,13.7,8.2,48,23.8,22.87,4.84,2023-08-30T06:39,2023-08-30T19:50,47467,43480.02,7.05,7.05,0,0,0,0,0,NaN
31/08/23,2,31,29.6,16.4,14.8,8.9,171,25.6,24.8,5.56,2023-08-31T06:40,2023-08-31T19:49,47313.98,43716.58,7.05,7.05,0,0,0,0,0,NaN
01/09/23,3,30.9,29.6,19.3,17.7,15,208,38.2,20.08,5.09,2023-09-01T06:41,2023-09-01T19:47,47160.1,42276.76,6.4,6.95,0,0,0,0,0,NaN
02/09/23,95,23.5,23.1,18.1,17.5,14.3,42,34.6,13.25,2.92,2023-09-02T06:42,2023-09-02T19:46,47005.44,13908.84,6.3,6.7,0,9.8,0,9.9,15,NaN
03/09/23,95,19.9,22,16,15.4,14.5,45,54,4.47,1.15,2023-09-03T06:43,2023-09-03T19:44,46850.12,0,6.7,6.85,9.3,17.1,0,26.2,21,NaN
04/09/23,95,22.9,24,18.1,18.8,8,306,43.6,9.82,1.9,2023-09-04T06:44,2023-09-04T19:42,46694.24,18147.22,6.3,6.75,0,20.3,0,20.3,16,NaN
05/09/23,3,27.2,27.7,16.4,17.9,7.2,117,19.8,22.4,4.31,2023-09-05T06:45,2023-09-05T19:41,46537.9,39693.85,6.9,6.9,0,0,0,0,0,NaN
06/09/23,3,28.6,30.2,19.1,20,8,98,23,19.63,3.99,2023-09-06T06:46,2023-09-06T19:39,46381.2,38779.6,6.6,6.75,0,0,0,0,0,NaN
07/09/23,3,28.2,29.3,20.2,21.8,9,108,22.7,18.35,3.86,2023-09-07T06:47,2023-09-07T19:37,46224.23,36790.46,6.65,6.75,0,0,0,0,0,NaN
08/09/23,3,30,30.6,20.4,22.4,9.7,130,27.4,21.38,4.53,2023-09-08T06:48,2023-09-08T19:36,46067.09,41471.32,6.7,6.7,0,0,0,0,0,NaN
09/09/23,3,27.4,27.3,19.9,21.4,12.4,151,37.4,17.58,3.86,2023-09-09T06:49,2023-09-09T19:34,45909.89,39808.59,6.5,6.65,0,0.4,0,0.4,3,NaN
10/09/23,80,28.9,29.5,18.6,19.6,8.9,92,36.4,18.49,3.96,2023-09-10T06:50,2023-09-10T19:32,45752.71,39352.35,6.4,6.6,0,1.6,0,1.6,8,NaN
11/09/23,80,26.1,25.8,18.5,20,11,227,33.1,20.36,4.07,2023-09-11T06:51,2023-09-11T19:31,45595.65,40559.94,6.6,6.6,0,0.7,0,0.7,3,NaN
12/09/23,80,25.8,25.4,16.7,17.2,7.2,314,21.6,19.98,3.96,2023-09-12T06:52,2023-09-12T19:29,45438.8,41296.95,6.5,6.5,0,0.4,0,0.4,4,NaN
13/09/23,1,28,28.4,16.3,15.5,12.2,40,33.1,22.14,4.46,2023-09-13T06:53,2023-09-13T19:28,45282.25,42025.68,6.5,6.5,0,0,0,0,0,NaN
14/09/23,80,27,28.2,18,17.6,9.5,65,28.8,17.51,3.7,2023-09-14T06:54,2023-09-14T19:26,45126.09,40832.37,6.4,6.4,0,0.8,0,0.8,7,NaN
15/09/23,95,25.1,25.2,17.8,18,12.5,84,32.4,13.61,2.84,2023-09-15T06:55,2023-09-15T19:24,44970.26,22906.84,6.05,6.35,0,7.9,0,7.9,14,NaN
16/09/23,3,23,22.7,16.7,17.4,8.9,156,27.4,11.56,2.51,2023-09-16T06:56,2023-09-16T19:23,44813.71,9553.19,4.9,6.25,0,0.2,0,0.2,1,NaN
17/09/23,80,19.7,19.5,16.2,16.3,12.8,178,51.1,7.89,1.67,2023-09-17T06:57,2023-09-17T19:21,44656.31,10471.58,5.1,6.15,1.8,3.6,0,5.5,7,NaN
18/09/23,3,20.7,20.3,14.5,14.7,9.8,209,29.5,12.65,2.31,2023-09-18T06:58,2023-09-18T19:19,44498.18,22762.07,5.35,6.15,0,0,0,0,0,NaN
19/09/23,45,24.4,24,13,13.4,7.7,51,23,19.48,3.5,2023-09-19T06:59,2023-09-19T19:18,44339.4,41165.45,6.1,6.1,0,0,0,0,0,NaN
20/09/23,3,25,23.4,13.4,13.5,14.8,232,41.8,20.68,4.37,2023-09-20T07:00,2023-09-20T19:16,44180.07,41006.16,6.2,6.2,0,0,0,0,0,NaN
21/09/23,80,18.2,17.5,14.3,12.6,20.8,233,55.4,5.31,1.75,2023-09-21T07:01,2023-09-21T19:14,44020.31,1979.38,4.5,5.95,0.1,0.3,0,0.4,3,NaN
22/09/23,3,21.1,19.5,11.4,9.7,9.7,289,23.8,20.28,3.7,2023-09-22T07:02,2023-09-22T19:13,43860.2,40685.69,6,6,0,0,0,0,0,NaN
23/09/23,3,23,21.8,10.4,8.9,5.3,55,17.3,20.69,3.56,2023-09-23T07:03,2023-09-23T19:11,43699.83,40524.7,6.1,6.1,0,0,0,0,0,NaN
24/09/23,0,26.8,25.6,11.7,10.7,4.8,44,15.1,20.68,3.72,2023-09-24T07:04,2023-09-24T19:09,43539.32,40363.34,6.1,6.1,0,0,0,0,0,NaN
25/09/23,0,28.8,28,13.3,12.4,5.4,39,18,20.47,3.89,2023-09-25T07:05,2023-09-25T19:07,43378.75,40201.7,6,6,0,0,0,0,0,NaN
26/09/23,3,28.3,27.5,14.5,13.6,4.7,54,13.7,18.58,3.54,2023-09-26T07:06,2023-09-26T19:06,43218.22,40039.87,5.65,5.95,0,0,0,0,0,NaN
27/09/23,3,28.3,27.9,15.6,15.2,6.9,79,18.4,18.82,3.63,2023-09-27T07:07,2023-09-27T19:04,43057.84,39877.95,5.8,5.9,0,0,0,0,0,NaN
28/09/23,3,29.2,28.3,14.8,15,9.7,226,26.3,19.48,3.93,2023-09-28T07:08,2023-09-28T19:02,42897.68,39716.05,5.85,5.85,0,0,0,0,0,NaN
29/09/23,1,30.9,30.4,15.3,14.4,7.6,22,22.3,19.42,3.87,2023-09-29T07:09,2023-09-29T19:01,42737.87,39511.4,5.8,5.8,0,0,0,0,0,NaN
30/09/23,1,30.8,31.2,16.4,16.2,4.8,39,15.5,19.1,3.69,2023-09-30T07:10,2023-09-30T18:59,42578.48,39170.06,5.7,5.7,0,0,0,0,0,NaN
01/10/23,2,31.5,30.8,16.4,16,6.3,41,18.4,19.09,3.76,2023-10-01T07:11,2023-10-01T18:57,42419.62,38943.11,5.65,5.65,0,0,0,0,0,NaN
02/10/23,3,30.3,29,15.7,14.8,6.2,58,16.6,18.63,3.74,2023-10-02T07:12,2023-10-02T18:56,42261.39,38739.21,5.3,5.6,0,0,0,0,0,NaN
03/10/23,3,30.2,29.1,15.6,15.4,6.5,64,18,18.24,3.64,2023-10-03T07:13,2023-10-03T18:54,42103.89,37725.04,5.5,5.5,0,0,0,0,0,NaN
04/10/23,3,29,29.1,16.7,16.8,9.4,59,22.7,18.13,3.65,2023-10-04T07:14,2023-10-04T18:53,41947.21,37917.68,5.4,5.4,0,0,0,0,0,NaN
05/10/23,0,30.9,30.2,16.2,16,5.4,50,15.1,18.14,3.64,2023-10-05T07:15,2023-10-05T18:51,41791.3,38155.35,5.35,5.35,0,0,0,0,0,NaN
06/10/23,0,31,29.9,16.3,15.7,6.5,42,18,18.19,3.84,2023-10-06T07:16,2023-10-06T18:49,41635,37985.8,5.3,5.3,0,0,0,0,0,NaN
07/10/23,3,30.4,29.3,15.9,14.4,6,43,17.6,17.92,3.74,2023-10-07T07:17,2023-10-07T18:48,41478.2,37051.39,5.25,5.25,0,0,0,0,0,NaN
08/10/23,3,30.7,29.7,14.5,13.1,5,27,12.6,17.75,3.41,2023-10-08T07:18,2023-10-08T18:46,41321,36789.01,5.2,5.25,0,0,0,0,0,NaN
09/10/23,3,29.4,28.1,15.2,14.1,4.8,35,11.9,17.4,3.42,2023-10-09T07:19,2023-10-09T18:45,41163.51,36500.64,5.2,5.2,0,0,0,0,0,NaN
10/10/23,3,28.3,27.5,14.3,12.7,4.7,32,11.9,17.4,3.29,2023-10-10T07:20,2023-10-10T18:43,41005.84,36809.67,5.15,5.15,0,0,0,0,0,NaN
11/10/23,3,28,26.1,13.5,12.1,7.3,56,19.4,17.31,3.36,2023-10-11T07:21,2023-10-11T18:41,40848.11,36312.14,5.1,5.1,0,0,0,0,0,NaN
12/10/23,1,28.2,26.2,13.6,11.8,5.9,50,16.6,16.97,3.29,2023-10-12T07:22,2023-10-12T18:40,40690.43,36456.3,5.05,5.05,0,0,0,0,0,NaN
13/10/23,3,26.4,24.1,13.8,12.5,10.7,296,28.4,13.18,3.04,2023-10-13T07:23,2023-10-13T18:38,40532.91,31293.75,3.85,4.95,0.1,0,0,0.1,1,NaN
14/10/23,61,21.7,21.4,15,15.5,9,199,22,9.76,1.82,2023-10-14T07:24,2023-10-14T18:37,40375.67,28084.97,4.8,4.8,4.8,0.1,0,4.9,8,NaN
15/10/23,61,21.2,20.4,12.3,12,8.7,231,23.4,10.81,2.12,2023-10-15T07:25,2023-10-15T18:35,40218.82,18258.32,4.25,4.85,1.8,0,0,1.8,5,NaN
16/10/23,61,20.8,19.3,14.7,15.6,11.2,218,29.9,10.08,1.96,2023-10-16T07:26,2023-10-16T18:34,40062.5,21605.59,3.9,4.75,1.3,0,0,1.3,6,NaN
17/10/23,61,23.5,22,16,16.3,19.3,179,58,8.87,2.53,2023-10-17T07:27,2023-10-17T18:32,39906.81,25003.77,4.5,4.65,0.9,0.2,0,1.1,6,NaN
18/10/23,61,20.5,18.4,16,14.8,19.8,227,54,12.14,2.53,2023-10-18T07:28,2023-10-18T18:31,39751.87,35357.88,4.45,4.6,1.1,0.8,0,2.1,5,NaN
19/10/23,95,17.1,16.2,12.5,11.3,22.8,203,66.2,1.3,0.69,2023-10-19T07:29,2023-10-19T18:29,39597.82,0,1.4,4.3,62.4,5.2,0,67.6,18,NaN
20/10/23,95,17.4,13.9,11.2,8.6,17.5,248,52.6,9.69,1.89,2023-10-20T07:30,2023-10-20T18:28,39444.77,28369.53,4.4,4.4,0,2.8,0,2.8,7,NaN
21/10/23,3,15.8,13.2,8.4,5.9,9.7,252,26.3,12.41,2.15,2023-10-21T07:32,2023-10-21T18:26,39292.86,35953.8,4.35,4.4,0,0,0,0,0,NaN
22/10/23,63,15.8,12.9,9.9,8.4,15,63,38.9,7.48,1.5,2023-10-22T07:33,2023-10-22T18:25,39142.22,12397.29,3.75,4.4,28.4,0.1,0,28.4,11,NaN
23/10/23,95,15.2,13.8,10.3,8.6,12.3,222,38.9,6.17,1.15,2023-10-23T07:34,2023-10-23T18:23,38992.98,15130.61,3.95,4.2,2.4,4,0,6.6,8,NaN
24/10/23,61,14,10.9,9.6,7.8,18.1,232,51.1,10.6,1.71,2023-10-24T07:35,2023-10-24T18:22,38845.27,27470.41,4.25,4.25,1,0,0,1,2,NaN
25/10/23,3,18.3,16.8,12.3,10.9,14.3,232,38.2,11.03,1.92,2023-10-25T07:36,2023-10-25T18:21,38699.05,28822.54,3.75,4.3,0,0,0,0,0,NaN
26/10/23,80,18.2,15.9,13.7,12.9,24.6,231,79.6,4.72,1.16,2023-10-26T07:37,2023-10-26T18:19,38553.05,2401.19,2.5,4.15,1.4,0.2,0,1.7,5,NaN
27/10/23,3,15.3,12.8,9.7,8.1,15.7,237,44.3,7.59,1.45,2023-10-27T07:38,2023-10-27T18:18,38407.14,28648.3,4.1,4.15,0,0,0,0,0,NaN
28/10/23,3,16.8,14.1,12,10.4,16.6,222,46.1,7.42,1.61,2023-10-28T07:39,2023-10-28T18:17,38261.45,27314.91,4,4.1,0,0,0,0,0,NaN
29/10/23,80,17,15.2,12.9,11.3,16.8,197,47.9,4.69,1.3,2023-10-29T07:40,2023-10-29T18:16,38116.12,0,2.5,3.9,0.5,2.2,0,2.9,12,NaN
30/10/23,80,15.5,12.8,10.3,8.8,14.5,225,47.9,9.32,1.56,2023-10-30T07:42,2023-10-30T18:14,37971.27,25018.91,3.9,3.9,8.1,5,0,13.2,16,NaN
31/10/23,45,13.7,12.3,7.4,6.2,4.3,165,14.4,6.53,1.02,2023-10-31T07:43,2023-10-31T18:13,37827.05,189.09,2.3,3.9,0,0,0,0,0,NaN
01/11/23,3,14.9,13.3,8.7,7.5,17.9,220,52.9,3.46,0.83,2023-11-01T07:44,2023-11-01T18:12,37683.6,1081.96,1,3.7,0,0,0,0,0,NaN
02/11/23,80,15.3,14,7.9,4,24.2,245,74.5,4.8,1.57,2023-11-02T07:45,2023-11-02T18:11,37541.06,17945.38,3.9,3.95,8.8,4.3,0,13.1,12,NaN
03/11/23,80,13.2,10.1,7.3,4,17.6,245,62.3,5.96,1.19,2023-11-03T07:46,2023-11-03T18:09,37399.59,17763.45,2.25,3.6,0.2,0.8,0,1,6,NaN
04/11/23,3,15.1,12.6,9.6,7.1,24.3,228,68.8,1.74,0.86,2023-11-04T07:47,2023-11-04T18:08,37259.32,622.86,0.4,3.55,0,0,0,0,0,NaN
05/11/23,3,14.2,11.2,8.9,6.7,13.8,238,37.8,8.84,1.63,2023-11-05T07:49,2023-11-05T18:07,37120.43,32016.81,3.7,3.7,0,0,0,0,0,NaN
06/11/23,3,13.5,9.5,6.2,3.9,13.1,270,36.4,11.93,1.89,2023-11-06T07:50,2023-11-06T18:06,36983.05,33553.87,3.6,3.6,0,0,0,0,0,NaN
07/11/23,3,11.2,8.5,3.9,1.5,9.8,241,28.4,8.63,1.14,2023-11-07T07:51,2023-11-07T18:05,36847.36,32084.02,3.5,3.5,0,0.1,0,0.1,1,NaN
08/11/23,61,12.7,10.4,5.3,3.5,8.8,213,23,8.06,1.16,2023-11-08T07:52,2023-11-08T18:04,36713.5,20207.36,3.5,3.5,0.5,0,0,0.5,4,NaN
09/11/23,61,16.3,13.2,9.7,7.8,12.6,238,34.6,12.14,1.88,2023-11-09T07:53,2023-11-09T18:03,36581.65,32247.24,3.35,3.5,0.5,0.7,0,1.2,5,NaN
10/11/23,61,15.2,12.4,9.3,6.8,13.6,251,36.4,9.68,1.78,2023-11-10T07:54,2023-11-10T18:02,36451.97,31502.28,3.4,3.45,1.6,0,0,1.6,4,NaN
11/11/23,3,18.2,16.7,12.1,9.9,16.9,240,45.7,8.75,1.49,2023-11-11T07:56,2023-11-11T18:01,36324.65,26647.44,3.25,3.4,0,0,0,0,0,NaN
12/11/23,3,19.2,17.8,12.4,11.2,14.2,238,37.4,10.61,1.76,2023-11-12T07:57,2023-11-12T18:00,36199.85,29058.45,3.2,3.4,0,0,0,0,0,NaN
13/11/23,3,18.5,18.1,13,12.8,9.2,225,24.5,9.17,1.46,2023-11-13T07:58,2023-11-13T17:59,36077.74,30728.88,3.35,3.35,0,0,0,0,0,NaN
14/11/23,45,17.5,17.5,10.2,9.8,5.5,192,15.8,9.79,1.4,2023-11-14T07:59,2023-11-14T17:58,35958.33,30756.79,3.35,3.35,0,0,0,0,0,NaN
15/11/23,45,16.9,17.2,10.7,10.5,4.9,71,15.1,8.36,1.22,2023-11-15T08:00,2023-11-15T17:57,35840.36,25100.03,3.05,3.3,0,0,0,0,0,NaN
16/11/23,45,16.4,16.8,9.6,9.2,5.4,162,16.9,8.4,1.2,2023-11-16T08:01,2023-11-16T17:57,35723.73,23252.81,3.25,3.25,0,0,0,0,0,NaN
17/11/23,45,16.7,16.5,10,9.6,3.9,59,11.9,8.55,1.22,2023-11-17T08:02,2023-11-17T17:56,35608.54,23784.87,3.25,3.25,0,0,0,0,0,NaN
18/11/23,45,18.4,18.1,8,6.7,4.5,33,11.5,10.23,1.44,2023-11-18T08:04,2023-11-18T17:55,35494.97,30171.61,3.2,3.2,0,0,0,0,0,NaN
19/11/23,45,19.1,18,6.9,5.4,4.8,27,13.7,10.85,1.53,2023-11-19T08:05,2023-11-19T17:54,35383.14,31297.79,3.2,3.2,0,0,0,0,0,NaN
20/11/23,45,17.9,17.2,6.7,5.1,6.1,357,15.1,10.26,1.48,2023-11-20T08:06,2023-11-20T17:54,35273.21,31345.22,3.15,3.15,0,0,0,0,0,NaN
21/11/23,3,13.3,9.4,7.1,3.8,19.1,7,46.1,10.05,1.82,2023-11-21T08:07,2023-11-21T17:53,35165.32,31023.64,3,3,0,0,0,0,0,NaN
22/11/23,2,13.9,9.2,5.2,2.6,21.7,12,54.4,10.27,2.18,2023-11-22T08:08,2023-11-22T17:52,35059.62,31377.82,3.05,3.05,0,0,0,0,0,NaN
23/11/23,0,14.3,10.6,2.3,-0.4,10.7,11,28.1,10.9,1.56,2023-11-23T08:09,2023-11-23T17:52,34956.28,31336.55,3.05,3.05,0,0,0,0,0,NaN
24/11/23,45,15.8,13.5,0.9,-1.9,4,318,11.9,10.67,1.4,2023-11-24T08:10,2023-11-24T17:51,34855.44,30968.21,3.05,3.05,0,0,0,0,0,NaN
25/11/23,45,16.8,14.6,1.6,-1,4,350,8.6,10.29,1.34,2023-11-25T08:12,2023-11-25T17:51,34757.27,30685.64,2.95,2.95,0,0,0,0,0,NaN
26/11/23,3,15.1,12.8,2.8,0.2,6,26,16.2,9.77,1.34,2023-11-26T08:13,2023-11-26T17:50,34661.91,28965.62,2.95,2.95,0,0,0,0,0,NaN
27/11/23,45,12.5,11,4.5,2.8,7.1,214,19.8,7.68,0.96,2023-11-27T08:14,2023-11-27T17:50,34569.55,28800,2.9,2.9,0,0,0,0,0,NaN
28/11/23,61,12.7,11.3,6.9,5.5,7.9,216,24.1,4.34,0.68,2023-11-28T08:15,2023-11-28T17:49,34480.32,4847.44,2.8,2.8,0.6,0,0,0.6,1,NaN
29/11/23,3,15,13,10.5,9.4,15.6,222,49.7,5.65,0.91,2023-11-29T08:16,2023-11-29T17:49,34394.42,27374.13,2.4,2.75,0,0,0,0.1,1,NaN
30/11/23,80,15.4,13.3,12.1,10.9,19.2,206,58,1.93,0.57,2023-11-30T08:17,2023-11-30T17:49,34311.99,2986.93,1.05,2.7,5.4,3.1,0,8.5,13,NaN
01/12/23,63,13.8,12,6.4,3,17.7,254,61.2,7.38,1.26,2023-12-01T08:18,2023-12-01T17:48,34233.21,22549.44,2.8,2.8,15.1,1.3,0,16.6,11,NaN
02/12/23,2,10.6,8,4.1,1.7,9.4,239,25.6,8.91,1.14,2023-12-02T08:19,2023-12-02T17:48,34158.25,29558.07,2.75,2.75,0,0,0,0,0,NaN
03/12/23,61,8.5,5.7,0.2,-2.6,7,173,21.6,8.41,0.97,2023-12-03T08:20,2023-12-03T17:48,34087.27,26307.31,2.75,2.8,0.1,0,0,0.1,1,NaN
04/12/23,61,10.4,7.5,5.5,3,12.2,218,34.9,5.45,0.79,2023-12-04T08:21,2023-12-04T17:48,34020.3,23257.37,2.7,2.7,2,0,0,2.1,3,NaN
05/12/23,3,8.2,5.3,3.3,0.5,9.4,16,25.6,4.68,0.77,2023-12-05T08:22,2023-12-05T17:48,33956.56,2449.2,1.85,2.7,0,0,0,0,0,NaN
06/12/23,3,10.2,7.7,1.8,-1,6,27,14.4,8.21,1.01,2023-12-06T08:23,2023-12-06T17:48,33895.94,28903.64,2.55,2.7,0,0,0,0,0,NaN
07/12/23,63,8.8,7.3,2.6,0.3,8.5,191,22.7,3.33,0.49,2023-12-07T08:24,2023-12-07T17:47,33838.5,957.63,1.75,2.6,11.6,0,0,11.7,9,NaN
08/12/23,80,12.2,8.6,7.5,4.6,16.3,272,44.3,8.96,1.53,2023-12-08T08:24,2023-12-08T17:47,33784.32,29391.3,2.6,2.6,0.1,0.6,0,0.7,3,NaN
09/12/23,45,13.3,12.2,5.6,3.9,9.3,228,24.8,5.03,0.74,2023-12-09T08:25,2023-12-09T17:48,33733.47,13181.71,2.45,2.6,0,0,0,0,0,NaN
10/12/23,45,12.8,12.5,9.4,8.8,5.7,240,15.8,2.97,0.51,2023-12-10T08:26,2023-12-10T17:48,33686.03,879.67,1,2.6,0,0,0,0,0,NaN
11/12/23,3,14.3,13.3,10.1,9.7,5.2,189,15.8,6.63,0.95,2023-12-11T08:27,2023-12-11T17:48,33642.07,26120.06,2.45,2.7,0,0,0,0,0,NaN
12/12/23,63,12.9,11.7,7.2,6.2,13.6,212,39.2,3.67,0.59,2023-12-12T08:28,2023-12-12T17:48,33601.65,4109.78,1.85,2.6,2.9,0.3,0,3.2,2,NaN
13/12/23,61,12.5,10.9,7.1,4.3,13.6,278,38.9,7.84,1.5,2023-12-13T08:29,2023-12-13T17:48,33564.85,27577.82,2.6,2.6,0.4,0.1,0,0.7,3,NaN
14/12/23,1,12,8.4,3.3,0.9,10.6,11,32.4,9.13,1.28,2023-12-14T08:29,2023-12-14T17:48,33531.73,29485.93,2.6,2.6,0,0,0,0,0,NaN
15/12/23,0,13.9,11.3,3.4,0.8,7.9,34,23.4,9.16,1.25,2023-12-15T08:30,2023-12-15T17:48,33502.37,29537.8,2.6,2.6,0,0,0,0,0,NaN
16/12/23,1,12.9,10.3,0.3,-2.6,4.7,14,12.6,9.36,1.11,2023-12-16T08:31,2023-12-16T17:49,33476.82,29501.65,2.6,2.6,0,0,0,0,0,NaN
17/12/23,45,11.9,9.4,-0.2,-3,4.4,28,14.8,9.16,1.05,2023-12-17T08:31,2023-12-17T17:49,33455.15,29468.49,2.6,2.6,0,0,0,0,0,NaN
18/12/23,45,12,9.4,-0.6,-3.4,4.5,1,11.5,9.12,1.03,2023-12-18T08:32,2023-12-18T17:49,33437.43,29438.4,2.65,2.65,0,0,0,0,0,NaN
19/12/23,45,11.5,8.9,-1.1,-3.8,4.9,31,14,9.05,1.02,2023-12-19T08:33,2023-12-19T17:50,33423.71,29508.4,2.7,2.7,0,0,0,0,0,NaN
20/12/23,61,12.2,7.3,0,-2.5,21,15,53.6,8.69,1.56,2023-12-20T08:33,2023-12-20T17:50,33414.05,26196.01,2.55,2.55,1.3,0,0,1.3,4,NaN
21/12/23,0,12.7,10.3,1.9,-0.9,5.9,334,17.3,8.85,1.06,2023-12-21T08:34,2023-12-21T17:51,33408.51,29366.87,2.65,2.65,0,0,0,0,0,NaN
22/12/23,45,13.8,11.5,2.1,-0.6,4.8,10,11.9,9.1,1.15,2023-12-22T08:34,2023-12-22T17:51,33407.14,29451.38,2.7,2.7,0,0,0,0,0,NaN
23/12/23,1,13,10.6,0.9,-2,6.6,17,21.2,9.14,1.11,2023-12-23T08:35,2023-12-23T17:52,33410,29542.83,2.7,2.7,0,0,0,0,0,NaN
24/12/23,0,11.8,9.2,0.7,-2.2,4.8,24,12.2,9.14,1.08,2023-12-24T08:35,2023-12-24T17:52,33417.15,29535.76,2.7,2.7,0,0,0,0,0,NaN
25/12/23,45,10.6,8.1,-1.3,-4.2,4.3,25,11.5,8.67,0.97,2023-12-25T08:36,2023-12-25T17:53,33428.64,27347,2.65,2.65,0,0,0,0,0,NaN
26/12/23,45,8.5,6.4,-2.5,-5.6,4.1,31,12.2,8.2,0.86,2023-12-26T08:36,2023-12-26T17:53,33444.41,24257.75,2.65,2.65,0,0,0,0,0,NaN
27/12/23,45,9.4,7.1,-0.9,-3.6,4.1,52,12.6,8.91,0.96,2023-12-27T08:36,2023-12-27T17:54,33464.39,29711.14,2.65,2.65,0,0,0,0,0,NaN
28/12/23,45,8.5,6,-0.4,-3,5.4,58,14.8,7.5,0.86,2023-12-28T08:36,2023-12-28T17:55,33488.5,22029.93,2.2,2.6,0,0,0,0,0,NaN
29/12/23,3,8.7,6.3,1.7,-1,4.8,29,12.2,4.89,0.64,2023-12-29T08:37,2023-12-29T17:55,33516.68,5419.07,1.9,2.55,0,0,0,0,0,NaN
30/12/23,45,12,9.1,0.9,-1.7,7.2,187,19.1,8.98,1.09,2023-12-30T08:37,2023-12-30T17:56,33548.84,29789.6,2.6,2.6,0,0,0,0,0,NaN
31/12/23,3,11.6,8.9,5.6,2.9,15,235,36.7,5.75,0.82,2023-12-31T08:37,2023-12-31T17:57,33584.91,18000,2.2,2.55,0,0,0,0,0,NaN
01/01/24,3,10.9,7.5,2.1,-0.5,8.7,227,21.6,9.19,1.09,2024-01-01T08:37,2024-01-01T17:58,33624.79,29892.59,2.6,2.6,0,0,0,0,0,NaN
02/01/24,45,8.5,6.9,2.1,-0.2,6.7,160,16.9,3.88,0.52,2024-01-02T08:37,2024-01-02T17:59,33668.41,5607.11,1.45,2.6,0,0,0,0,0,NaN
03/01/24,61,12.8,11.9,8.8,7.3,10,221,29.5,1.96,0.39,2024-01-03T08:37,2024-01-03T17:59,33715.69,0,0.4,2.6,2.4,0.1,0,2.5,9,NaN
04/01/24,80,10.9,9.8,7.2,6.1,7.1,206,20.9,3.03,0.48,2024-01-04T08:38,2024-01-04T18:00,33766.54,6916.51,1.4,2.55,3.1,2.2,0,5.2,7,NaN
05/01/24,95,9.7,6.4,5.1,2,13,273,37.1,7.73,1.22,2024-01-05T08:38,2024-01-05T18:01,33820.87,30112.49,2.55,2.55,0.1,2.3,0,2.5,11,NaN
06/01/24,2,9.6,6,2.8,-0.2,10.2,282,28.4,8.37,1.23,2024-01-06T08:38,2024-01-06T18:02,33878.59,30177,2.6,2.6,0,0,0,0,0,NaN
07/01/24,3,9.4,6.5,0.9,-1.9,4,318,14.4,9.53,1.08,2024-01-07T08:37,2024-01-07T18:03,33939.63,29822.19,2.7,2.7,0,0,0,0,0,NaN
08/01/24,3,8,4.9,-0.5,-3.6,5.4,184,17.6,8.89,1,2024-01-08T08:37,2024-01-08T18:04,34003.91,25847.21,2.8,2.8,0,0,0,0,0,NaN
09/01/24,61,7.8,5.5,3.5,1.1,4.8,88,14.4,6.5,0.8,2024-01-09T08:37,2024-01-09T18:05,34071.3,20733.59,2,2.65,0.4,0,0,0.4,4,NaN
10/01/24,61,8.2,5,4.1,1.9,13,238,33.1,4.49,0.6,2024-01-10T08:37,2024-01-10T18:06,34141.76,868.64,1.55,2.7,1.1,0,0,1.1,8,NaN
11/01/24,45,8,4.9,2,-0.8,7.1,41,21.2,9.03,1.1,2024-01-11T08:37,2024-01-11T18:07,34215.18,30086.11,2.8,2.8,0,0,0,0,0,NaN
12/01/24,3,7.3,4.1,-0.3,-3.9,8.2,41,21.6,9.81,1.09,2024-01-12T08:37,2024-01-12T18:08,34291.46,30636.17,2.8,2.9,0,0,0,0,0,NaN
13/01/24,3,9.2,7,0.8,-2.3,6.1,43,19.1,6.08,0.79,2024-01-13T08:36,2024-01-13T18:09,34370.69,24523.17,2.15,2.85,0,0,0,0,0,NaN
14/01/24,61,9.9,8.1,4.4,2.3,7.7,63,18.7,4.01,0.6,2024-01-14T08:36,2024-01-14T18:10,34453.73,6239.21,2.3,2.85,0.5,0,0,0.5,2,NaN
15/01/24,80,13.7,12.1,7.3,6,15.3,231,39.6,2.95,0.49,2024-01-15T08:36,2024-01-15T18:11,34540.6,687.14,1.15,2.8,13.7,0.9,0,14.8,16,NaN
16/01/24,61,14.2,13.1,10.6,8.7,14.9,216,36.4,3.77,0.77,2024-01-16T08:35,2024-01-16T18:12,34631.13,0,1.7,2.8,0.2,0,0,0.2,2,NaN
17/01/24,80,12.3,9.2,10.5,7.3,21.8,215,65.5,4.32,0.93,2024-01-17T08:35,2024-01-17T18:14,34725.15,13877.2,2.65,2.8,12.8,2.7,0,15.6,16,NaN
18/01/24,61,14.5,12,10.4,7.2,19.4,235,52.9,7.97,1.4,2024-01-18T08:34,2024-01-18T18:15,34822.48,25983.18,2.8,2.95,0.5,0.4,0,0.9,2,NaN
19/01/24,63,10.2,9.8,4.5,0.2,22.7,39,57.6,1.12,0.53,2024-01-19T08:34,2024-01-19T18:16,34922.95,0,0.35,2.65,34.9,2.7,0,37.6,21,NaN
20/01/24,3,9.7,7.1,1.4,-1.4,11.7,41,30.2,10.55,1.32,2024-01-20T08:33,2024-01-20T18:17,35026.38,31128.27,3.05,3.05,0,0,0,0,0,NaN
21/01/24,45,11.9,9.6,3.1,0.8,5.4,283,14.8,10.12,1.27,2024-01-21T08:33,2024-01-21T18:18,35132.61,31565.87,3,3,0,0,0,0,0,NaN
22/01/24,45,10.2,8.8,1.3,-1.1,4.2,69,12.2,8.45,1.03,2024-01-22T08:32,2024-01-22T18:19,35241.46,27096.42,2.85,3.1,0,0,0,0,0,NaN
23/01/24,45,15.4,14.4,2.8,0.5,4.5,32,10.8,10.66,1.38,2024-01-23T08:31,2024-01-23T18:21,35352.79,31807.44,3.2,3.2,0,0,0,0,0,NaN
24/01/24,45,18.3,17.5,4.6,2.4,5.2,29,12.6,10.88,1.52,2024-01-24T08:31,2024-01-24T18:22,35466.42,31931.84,3.3,3.3,0,0,0,0,0,NaN
25/01/24,45,18.7,16.9,3.4,1.1,4.8,34,11.5,11.11,1.59,2024-01-25T08:30,2024-01-25T18:23,35582.19,32052.95,3.35,3.35,0,0,0,0,0,NaN
26/01/24,45,19.6,17.4,4.4,1.9,5.1,23,12.2,9.72,1.51,2024-01-26T08:29,2024-01-26T18:24,35699.94,32131.37,3,3.4,0,0,0,0,0,NaN
27/01/24,3,19,16.6,5.7,3.3,5.9,32,16.6,9.89,1.61,2024-01-27T08:28,2024-01-27T18:25,35819.53,32209.9,2.95,3.45,0,0,0,0,0,NaN
28/01/24,3,17.6,15.7,5.3,3.1,4.9,47,15.1,11.17,1.63,2024-01-28T08:27,2024-01-28T18:27,35940.8,32288.4,3.2,3.45,0,0,0,0,0,NaN
29/01/24,3,14.6,12.4,6,4,5,51,14.4,8.55,1.3,2024-01-29T08:27,2024-01-29T18:28,36063.6,24104.94,2.9,3.4,0,0,0,0,0,NaN
30/01/24,45,13.9,12.6,4.4,2.5,3.4,66,10.1,11.7,1.54,2024-01-30T08:26,2024-01-30T18:29,36187.78,32406.96,3.4,3.4,0,0,0,0,0,NaN
31/01/24,45,13.4,12,2.4,0.1,4,30,10.4,11.1,1.43,2024-01-31T08:25,2024-01-31T18:30,36313.2,29260.04,3.45,3.45,0,0,0,0,0,NaN
01/02/24,45,18,15.8,2.7,-0.1,5.4,8,15.1,12.27,1.76,2024-02-01T08:24,2024-02-01T18:31,36439.73,32488.78,3.5,3.5,0,0,0,0,0,NaN
02/02/24,1,16.1,13.6,3.3,0.7,15.4,39,40.3,12.16,1.81,2024-02-02T08:23,2024-02-02T18:33,36567.41,32494.95,3.45,3.45,0,0,0,0,0,NaN
03/02/24,1,16.6,13.8,3.7,1.4,6.3,37,18.4,12.68,1.84,2024-02-03T08:22,2024-02-03T18:34,36697.54,32584.66,3.5,3.5,0,0,0,0,0,NaN
04/02/24,0,18.2,15.3,2.1,-0.6,4.9,11,13,12.83,1.85,2024-02-04T08:21,2024-02-04T18:35,36830.2,32652.31,3.55,3.55,0,0,0,0,0,NaN
05/02/24,3,16.2,13.5,2.3,-0.3,5.5,3,15.8,10.43,1.56,2024-02-05T08:20,2024-02-05T18:36,36965.21,32043.02,3.1,3.6,0,0,0,0,0,NaN
